Titel_Autor,Autorenvorname,RASignatur,Beginnt mit,Volltext
DR.KUHN (PF/GS),,88225,S,"88*225	Dr. Kühn (PF/GS) Weber, Rolf H.   Informatik und Jahr 2000. Risiken und Vorsorgemöglichkeiten aus rechtlicher Sicht. Publikatio- nen aus dem Zentrum für Informations- und Kommunikations- recht der Universität Zürich. 3. Zürich: Schulthess Polygraph"
FRAU HOLLIGER (PF/GSRD),,88226,S,"88*226	Frau Holliger (PF/GSRD) Weber, Rolf H.   Informatik und Jahr 2000. Risiken und Vorsorgemöglichkeiten aus rechtlicher Sicht. Publikatio- nen aus dem Zentrum für Informations- und Kommunikations- recht der Universität Zürich. 3. Zürich: Schulthess Po"
FRAU LÖER (CH/ITMM),,88227,S,"88'227____________________________Frau Löer (CH/ITMM) Joseph, Mark. Y2K. Der letzte Tag. Roman. Aus dem Amerika nischen übersetzt von Sabine Maier-Längsfeld. München: Schneekluth Verlag GmbH, 1999.      -22cm.414 S. "
FRAU SCHENK (CH/UI),K.,88228,S,"88'228	Frau K.Schenk (CH/U1) Aemter und Gerichte im Schuldbetreibungs- und Konkurs- wesen, Aarau: Inkasso und Treuhand AG Schatzmann, 1999. -25cm.478 S. "
WEISS (CH/UI),JOSEF,88229,S,"88'229	Weiss, Josef (CH/Ul)______ Aemter und Gerichte im Schuldbetreibungs- und Konkurs- wesen. Aarau: Schatzmann Inkasso und Treuhand AG, 1999. -25cm.478 S. "
CATELLANI (CH/STIZ),B.,88230,S,"88*230    _____________ Catellani, B. (CH/STIZ)_____ Pearson, lan (Hrsger).   Der Fischer Atlas Zukunft. Aus dem Englischen von Bettina Schäfer und Käthe Fleickenr stein. Frankfurt/Main: Fischer Taschenbuch Verlag GmbH, 1998. -25cm.128 S.fill. "
HÄMMERLI (MS/IBSM),,88231,S,"88*231	Mammarii (MS/IBSM) Siegert, Andreas.   The AIX survival guide.(Reprint). Harlow, England: Addison Wesley Longman Limited, 1998. -24cm.XX,465 p "
SCHMID (CH/ITPR),H.P.,88232,S,"88*232	.             H.P.Schm.L'i ^CH/ITPR) Cockburn, Alistair.   Surviving object-oriented projects. A managers guide. (2nd printing.„The Addison Wesley object technology series). Reading, MA: Addison Wesley Longman, Inc., 1998.   -24cm. -XXI,250 p "
SCHMID (CH/ITPR),H.P.,88233,S,"88'233	H.P. Schmid (CH/ITPR) Rumbaugh, James ; Jacobson, Ivar ; Booch, Grady.  The Unified Modeling Language reference manual. (The Addison- Wesley object technology series). Reading, MA: Addison Wesley Longman, Inc., 1998.  -24cm. XVII,550 p., 1 CD-ROM. "
SCHMID (CH/ITPR),H.P.,88234,S,"88'234	H.P. Schmid (CH/ITPR) Jacobson, Ivar; Booch, Grady; Rumbaugh, James.   The Unified software development process. (The Addison-Wesley object technology series). Reading, MA: Addison Wesley Longman, Inc., 1999.   -24cm. XXIX,463 p. "
SCHMID (CH/ITPR),H.P.,88235,S,"83'2J5""	HP Schmid (CH/ITPR) Booch, Grady, Rumbaugh, James; Jacobson, Ivar.   The Unified Modeling Language user guide. (3rd printing. The Addison-Wesley object technology series). Reading, MA: Addison Wesley Longman, Inc., 1999.  -24cm, XXII,482 p. "
SCHMID (CH/ITPR),H.P.,88236,S,"88'236	H.P. Schmid (CH/ITPR) Royce, Walker._ Software project management. A Unified framework. (The Addison-Wesley object,technology series). Reading, MA: Addison Wesley Longman, Inc., 1998.  -24cm. XXVIII,406 p. "
RITZ (CH/UG),K.,"88237/1,2",S,"88*237/1,2	K. Ritz (CH/UG) Klassifikation, internationale statistische, der Krank- heiten und verwandter Gesundheitsprobleme. 10. Revision, ICD-10. Amtliche deutschsprachige Ausgabe. 2 Teile. (Teil 1: Bd.l: Systematisches Verzeichnis. Version 1.0: Stand: "
RIEDI (CH/STIZ),,88238,S,"88'238	Riedi (CH/STIZ) Fondsführer Schweiz 1999, 7. Jahrgang. Zug: Lipper Schweiz AG, 1999.	-24cm.1115 S., l CD-ROM. "
BRÄM (CH/STRD),,88239,S,"88'239	Bräm (CH/STRD) Kieser, Ueli.   Das Verwaltungsverfahren in der Sozial- versicherung. (Stand von Rechtsprechung und Gesetzgebung 1. Januar 1999). Zürich: Schulthess Polygraphischer Verlag AG, 1999. -23cm.XLVII,367 S "
BRÄM (CH/STRD),,88240,S,"88'240	Bräm (CH/STRD) Bundesverwaltungsrecht, schweizerisches. Hrsg. von Hein- rich Koller, Georg Müller,""René Rhinow, Ulrich Cimmerii; Soziale Sicherheit. Mit Nachträgen. Basel: Helbing & Lichtenhahn Verlag AG, 1998 ff.  -26cm. Ordner. "
DR.REIMER (CH/IFUE),,88241,S,"88'241	___        Dr. Reimer (CH/IFUE?______ Knowledge management handbook. Ed. by Jay Liebowitz. Boca Raton, PL: CRC Press, 1999.         -27cm.X,298 p; "
CATELLANI (CH/STIZ),,88242,S,"88'242	Catellani (CH/STIZ) Balenii, Said.   Access 97 - Kompendium. (Ueberarbeitete Neuauflage). Haar/München: Markt & Technik Buch- und Software-Verlag GmbH, 1998.	-25cm.1136 S., l CD-ROM. "
ALICH (CH/ITDM),,88243,S,"88'243_____________________Auch (CH/ITDM)__________ English, Larry P.   Improving Data Warehouse and infor- mation quality. Methods for reducing costs and increa- sing profits. New York: John Wiley & Sons, Inc., 1999.        -24cm. XXVI,518 p. "
DR.FEHR (PF/GSRD),,88244,S,"88'244	Dr.Fehr (PF/GSRD) Zach, Roger.   Schweizerisches Kartellrecht. Unter Mit- arbeit von Mani Reinert. (Stampflis juristische Lehr- bücher) . Bern: Stämpfli Verlag AG, 1999.       -23cm.XLII,410 S. "
EISNER (CH/ISTB),,88245,S,"88'245	Eisner (CH/ISTB) DeMarco, Tom.   Der Termin. Ein Roman über Projektmanage; ment. (Aus dem Englischen übersetzt von) Doris Martin. München: Carl Hanser Verlag, 1998        -23cm.VI,266 S, "
FRAU MÄCHLER (TR/RW),,88246,S,"88'246	Frau Mächler (TR/.RW) Klenger, Franz; Falk-Kalms, Ellen.  Kostenstellen-Rech- nung mit SAP R/3. Mit Testbeispiel und Customizing für Studenten und Praktiker. 2. Auflage. (Ausbildung und Studium). Braunschweig: Friedrich Vieweg & Sohn Verlagsgesells"
SCHÜRMANN (TR/KC),ST.,88247,A,"SS'247	St.Schürmann (TR/KC) Graf, Hans Georg.   Prognosen und Szenarien in der Wirt- schaftspraxis. Unter Mitarbeit von Roland Sütterlin. Zürich, München: Verlag Neue Zürcher Zeitung; Carl Hanser Verlag, 1999.	-23cm.315 S. "
KRYNSKI (CH/UNS),,88248,S,"88'248	Krynski (CH/UNS) AntiPatterns. Refactoring software, architectures and projects in crisis. By William J. Brown, Raphael C.Mal- veau a.o. (Wiley computer publishing). New York: John Wiley & Sons, Inc., 1998.         -25cm. XXV,309 p. "
MEIER (PF/GSSD),K.J.,88249,S,"88*249	K.-J.Meier (PF/GSSD) Locher, Peter.   Einführung in das interkantonale Steuer- recht , unter Berücksichtigung des Steuerharmonisierungs- sowie des bernischen Steuergesetzes. (Stampflis juristi- sche Lehrbücher). Bern: Stämpfli Verlag AG, 1999.	-23c"
TAPPÉ (MS/IBSM),,88250,S,"88'250	Tappe (MS/IBSM) Microsoft SQL Server 7.0 Datenbank-Implementierung, Ori- ginal Microsoft Training. ( 14 . Auflage). Unterschleissheim: Microsoft Press Deutschland, 1999. -24cm.XXXV, 695 S . , X- CD-ROMÌÒ. "
DR.ARDIELLE (TR/KC),,88251,S,"88*251	Dr. Ardielle (TR/KC) International Accounting Standards 1998. Deutsche Fas- sung. Hrsger: IÂSC. Stuttgart: Schaffer-Poeschel Verlag, 1999.        -24cm. XXII,966 S. "
FRAU BOZZATO (CH/STSD),,88252,S,"88'252	Frau Bozzato (CH/STSD) (International Accounting Standards 1998. Deutsche Fas- sung. Hrsger: IASC. Stuttgart: Schaffer-Poeschel Verlag, 1999.       -24cm. XXII,966 S, "
FRAU HOLLIGER (PF/GSRD),,88253,S,"88'253 Frau Holliger (PF/GSRD) Widmer, Ursula; Bähler, Konrad.   Rechtsfragen beim Electronic Commerce. Sichere Geschäftstransaktionen im Internet. Zürich: Orell Füssli Verlag, 1997. -23cm 403 S "
FRAU HOLLIGER (PF/GSRD),,88254,S,"88'254	Frau Holliger (PF/GSRD) Informatikrecht im europäischen Umfeld, Hrsger: Rolf H. Weber, (Publikationen des Europa Instituts Zürich. Band 18). Zürich: Schulthess Polygraphischer Verlag AG, 1997. -23cm.269 S. "
TAPPÉ (MS/IBSM),,88255,S,"88'255'	Tappe (MS/IBSM) Microsoft MCSE-Prüfungsvorbereitung 70-068: Microsoft Windows NT 4.0 Server im Unternehmen. Unterschleissheim: Microsoft Press Deutschland, 1999. -24cm.XXI,443 S.,1 CD-ROM. "
KRYNSKI (CH/UNS),,88256,S,"88'256______________________Krynski (CH/UNS)__________ Software-Architektur, pattern-orientierte. Ein Pattern- System. Deutsche Uebersetzung von Christiane Löckenhoff / Frank Buschmann, Regine Meunier u.a. Bonn: Addison Wesley Longman Verlag GmbH, 1998.  "
KELLER (MS/IBSM),MARCEL,88257,S,"88*257	Marcel Keller (MS/IBSM) Kuppinger, Martin.   Microsoft Windows 2000 Migrations- planung. Unterschleissheim: Microsoft Press Deutschland, 1999. -24cm.VII,220 S.,l CD-ROM. "
FRAU DOLDER (CH/SLS),,88258,S,"88'258	Frau Dolder (CH/SLS) Bolanz, Max; Reinhart, Matthias.   Erben und Schenken. Steueroptimiert, mit Weitblick und System: Die richtige Planung von Erbschaften und Schenkungen, vz Ratgeber / Bilanz. Zürich: VZ Vermögenszentrum, 1999.         -21cm.145 "
MEIER (PF/GSSD),K.J.,88259,S,"88'259	K.-J.Meier (PF/GSSD) Bolanz, Max; Reinhart, Matthias.   Erben und Schenken. Steueroptimiert, mit Weitblick und System: Die richtige Planung von Erbschaften und Schenkungen. VZ Ratgeber/ Bilanz. Zürich: VZ Vermögenszentrum, 1999.         -21cm.145 S"
FRAU BOHNERT (FI/AS),,88260,S,"88'260	Frau Bohnert (FI/AS) Demuth, Michael; Bustorf, Henrik; Thiel, Olaf.   Invest- mentfonds. Produkte, Fakten, Strategien. Geldanalage professionell. Wiesbaden: Betriebswirtschaftlicher Verlag Dr.Th.Gabler GmbH, 1995.	-21cm.XI,207 S. "
FRAU HÜGLI (CH/POZL),,88261,S,"88'261	Frau Hügli (CH/POZL) Pschyrembel, W.   Klinisches Wörterbuch. 258. *Auflage. Berlin: Walter de Gruyter, 1997.	_    -23cm, XXIII,1745 S.fill. "
FRAU BOHNERT (FI/AS),,88262,S,"88'262	Frau Bohnert (FI/AS )________ Otter, Matthäus Jan den.   Investmentfonds. Grundlagen, Risiken, Chancen. Zürich: Verlag Neue Zürcher Zeitung; Carl Hanser Verlag, 1999.	-23cm.184 S. "
MÜLLER (CH/POZ),G.,88263,S,"88'263_______________________Müller, G. (CH/POZ)_____ Lattmann, Jürg M.; Trachsler, Jacques; Horlacher, Félix. Das neue Sparbuch. (2. Auflage). Geld-Rezepte mit Pep. Zürich: Werd Verlag, 1997.	-21cm.80 S. "
SCHMIDT (CH/U3),PIUS,88264,S,"88'264	Schmidt, Pius (CH/U3) Handbuch mit Leitfaden der Personenversicherung. ""Aus der Praxis - für die Praxis"". (Autor: Ruedi Schläppi). Mit Nachträgen. Blauen: ASSI Stiftung zum Schutz der Versicherten, 1999--: -32cm.Ordner, "
FRAU À PORTA (FI/AS),N.,88265,S,"88*265	Frau N. à Porta (FI/AS) Langenscheiät.   L's Handwörterbuch Englisch ... 4.Aufl Berlin: Langenscheidt KG, 1999.        -25cm.1493+28 S "
STADLER (FI/AS),URS,88266,S,"88*266	Urs Stadier (FI/AS) Langenscheidt.   L'sHandwörterbuch Englisch ... 4.Aufl Berlin: Langenscheidt KG, 1999.       -25cm.1493+28 S. "
FRAU À PORTA (FI/AS),,88267,S,"88'267      '	Frau à Porta (FI/AS) Langenscheidt.   L?s Handwörterbuch Französisch. 4.A. Berlin: Langenscheidt KG, 1998,       -25cm.1600+28 S. "
STADLER (FI/AS),URS,88268,S,"88*268	Urs Stadier (Fl/AS) Langenscheidt.   L1s Handwörterbuch Französisch. 4.Aufl Berlin: Langenscheidt KG, 1998.        -25cm.1600+28 S. "
FRAU HASSE (CH/ITDM),,88269,S,"88'a69	Frau Hasse (CH/ITDM) English, Larry P.   Improving data warehouse and business information quality. Methods for reducing costs and in- creasing profits. New York: John Wiley & Sons, Inc., 1999.         -24cm. XXVI,518 p. "
BRÄM (CH/STRD),,88270,S,"88'270	Bräm (CH/STRD) Kommentar zum schweizerischen Privatrecht: Update. Hrsger; Heinz Hausheer. Schweizerisches Zivilgesetzbuch, Das Obligationenrecht-. Der Arbeitsvertrag, Art.319-355 OR; der Gesamtarbeitsvertrag, Art.356-362 OR. {Berner Kommen- tar. 2A"
BRÄM (CH/STRD),,88271,S,"88*271	Bräm (CH/STRD) Luzern/Kanton,   Systematische Rechtssammlung des Kan- tons Luzern (SRL). Mit Luzerner Gerichts--und Verwal- tungsentscheide 1994-1997. CD-ROM-Ausgabe.Stand:1.1.1999. Luzern: Staatskanzlei des Kantons Luzern, 1999 ff. -13cm.l CD-ROM,"
FRAU BOZZATO (CH/STSD),,88272,S,"88'272	Frau Bozzato (CH/STSD) Potonnier, Georges Ed,; Potonnier, Brigitte.   Wörter- buch für Wirtschaft Recht und Handel = Dictionnaire de l'économie, du droit et du commerce. 3., völlig neu be- arbeitete und erweiterte Auflage. Band I: Deutsch-Fran- zös"
FRAU BOZZATO (CH/STSD),,"88273/1,2",S,"88*273/1,2	Frau Bozzato {CH/STSD)________ Robert, Paul.   Le nouveau petit Robert. Dictionnaire alphabétique et analogique de la langue française. Nou- velle édition du Petit Robert de Paul Robert. Texte re- manié et amplifié sous la direction de Josette "
FRAU BOZZATO (CH/STSD),,88274,S,"88'274	Frau Bo^f.fitn ffH/sTfin) Duden.   Deutsches Universalwörterbuch. 3., neu bearbeite- te und erweiterte Auflage. Auf der Grundlage der neuen amtlichen Rechtschreibung . . . Mannheim: Dudenverlag, 1996.	-25cm. 1816 S. "
FRAU HOLLIGER (PF/GSRD),,88275,S,"88*275	Frau Holliger (PF/GSRD) Kühn, Matthias.   Rechtshandlungen mittels EDV und Tele- kommunikation . Zurechenbarkeit und Haftung. (Diss.Univ. Regensburg. Schriftenreihe Recht der Computerpraxis. Band l). München: C.H.Beck'sche Verlagsbuchhandlung,1991."
FRAU HOLLIGER (PF/GSRD),,88276,S,"88'276__________________Frau Holliger (PF/GSRp)______ Rutkowsky, Heinz; Gerhardt,	Bernd.  Leitfaden des Com- puterrechts . Vertragsrecht,	Urheberrecht, Strafrecht. Stuttgart: Schaffer Verlag,	1989.      -21cm.XVI,223 S. "
BRÄM (CH/STRD),P.,88277,S,"88'277	P. Bräm (CH/STRD) Izzo, Pierre.   Lebensversicherungsansprüche und -anwart. Schäften bei der guter- und erbrechtlichen Auseinander- setzung ... Diss.Univ.Freiburg/Schweiz) ... Freiburg/Schweiz.- Università tsverlag, 1999,       -23cm. LIV.406 S. "
CATELLANI (CH/STIZ),,88278,S,"88'278	Catellani (CH/STIZ) Betriebszählung 1995. Die Klein- und Mittelunternehmen als Träger der schweizerischen Volkswirtschaft ... Neuch'atel: Bundesamt für Statistik, 1999.  -30cm.185 S., Graph.,Tab. "
VD KEISER (CH/UI),E.,88279,S,"88'279	VD E. Keiser (CH/U1 Hunziker-Blum, Felix.   Kundenorientierte Schadenerledi- gung. Ein Beitrag zu Theorie und Praxis ... Zürich: Schulthess Polygraphischer Verlag AG, 1998. -23cm.198 S, "
FRAU DOLDER (CH/SLS),K.,88280,S,"88'280	Frau K. Dolder (CH/SLS) Kirschner, Josef.   So siegt man, ohne zu kämpfen. Die 13 Strategien gegen die Agression im Alltag.(4.Auflage). München: F.A.Herbig Verlagsbuchhandlung GmbH, 1999). -22cm.224 S. "
FRAU WEYERMANN (CH/STSD),,88281,S,"88'281	Frau Weyermann (CH/STSD) Rehbinder, Manfred.   Droit suisse du travail. Adaptation française par Bernard Schneider. (Précis de droit Staempf- li). Berne: Editions Staempfli & Cie SA, 1979.    -23cm.241 p. "
CRAUSAZ (CH/IX),,88282,S,"88'282	Crausaz (CH/IX) Zahn, Hans E.   Dictionary of banking and stock trading. Part 2: English-German = Wörterbuch, für das Bank- und Börsenwesen ... updated and much enlarged 4th. edition. Frankfurt/Main: Fritz Knapp Verlag GmbH, 1996.    -20cm. 536 S. "
FRAU HELLWIG (CH/IE),A.,88283,S,"88'283	Frau A.Hellwig (CH/IE) Gulbins, Jürgen; Obermayr, Karl.   AIX UNIX SystemV,4. Begriffe, Konzepte, Kommandos. (Springer Compass). Berlin: Springer-Verlag, 1996.	-24cm.IX,591 S. "
SAI (CH/IX),,88284,S,"88*284     _____     _____ Sai (CH/IX)________ Monson-Haefel, Richard,   Enterprise Java Beans. Sebastopol, CA: O'Reilly & Associates, Inc., 1999 -24cm.XVI,317 p "
SAI (CH/IX),,88285,S,"88*285_____________________________ Sai fCH/IX)______ Pardi, William 3.   XML in action. Redmond, WA: Microsoft Press, 1999.	-24cm. XXII,329 p., 1 CD-ROM. "
WEIS (MS/IBSM),R.,88286,S,"88'286	,   R. Weis (MS/IBSM) Webb, Jeff.   Special edition using Excel Visual Basic for applications. 2nd edition. Indianapolis, IN: Que Corporation, 1998.         -24cm, XXI,868 p, "
FÖRG (MS/IBSM),R.,88287,S,"88'287	R. Förg (MS/IBSM) Handschuch, Thomas.   Solaris 7 Systemadministration. Management von Workstation und Server mit Solaris 2 und Solaris 7 auf SPARC und Intel. 2., vollständig überarbei- tete Auflage. Berlin: Springer-Verlag, 1999.	-24cm. XVIII,897 "
MÜLLER (CH/PS),EUGEN,88288,S,"88'288	Eugen Müller (CH/PS) Bolanz, Max; Reinhart, Matthias.   Erben und Schenken. Steueroptimiert mit Weitblick und System ... (2.*Aufl.) Zürich: VZ Vermögenszentrum, 1999.        -21cm.145 S. "
DR.MÜHLEBACH (ID),,88289,S,"88'289	Dr. Mühlebach (ID) Müller-Möhl, Ernst.   Optionen und Futures.Grundlagen und Strategien für das Termingeschäft in der Schweiz, Deutschland und Oesterreich. 4. Auflage, auf Basis der dritten, von Carole Ackermann, Jürgen Krebs und Marcel Künzle bear"
DR.MÜHLEBACH (ID),,88290,S,"88'290	Dr. Mühlebach (ID) Kneschaurek, Francesco.   Weltwirtschaft im Umbruch. Pro- bleme, Analysen, Perspektiven. Zürich: Verlag Neue Zürcher Zeitung, 1999.  -23cm.286 S. "
KUHNEN (CH/SLS),IRINA,88291,S,"88291	Kühnen Irina (CH/SLS) Volkart, Rudolf.   Unternehmensbewertung und Akguisiti- onen. Unter Mitarbeit von Reto Suter, Thomas Vettiger. Zürich: Versus Verlag AG, 1999.	-24cm.236 S. "
JÄGGI (CH/SLS),CHR.,88292,S,"88'292	Jäggi, Chr. (CH/SLS) Fondsführer Schweiz 1999. 7. Auflage. In Zusammenarbeit mit CASH. Mit l CD-ROM. Zug: Lipper Schweiz AG, 1999.   -24cm.115 S.,l CD-ROM. "
BOZZATO (CH/STSD),,"88293/1,2",S,"88'293/l,2	Bozzato (CH/STSD) Wörterbuch für Recht und Wirtschaft deutsch-Italienisch/ Italienisch-Deutsch von Hannelore Troike Strambaci und Elisabeth Helffrich Mariani. 2., neu bearbeitete Auflage, 2 Bände. Bd.1s Deutsch-Italienisch. X,1538 S.,1997; Bd.2"
BOZZATO (CH/STSD),,88294,S,"88'294	Bozzato (CH/STSDJ Cesana, Gianni.   Dizionario ragionato dei sinonimi e dei contrari.(Nuova edizione). ""a  e • Milano: Giovanni De Vecchi Editore, 1998.    -21cm.779 p. "
MEISTER (CH/ITEU),,88295,S,"88'295	Meister (CH/ITEU) Microsoft Systems Management Server 2.0 Training. With 1 CD-ROM. Redmond, WA: Microsoft Press, 1999.   -24cm.XLVIII,751 p. 1 CD-ROM: "
FRITZ (CH/IE),M.,88296,S,"88'296	M. Fritz (CH/IE)_______ English, Larry P.   Improving Data Warehouse and business information quality ... New York: John Wiley & Sons, Inc., 1999.         -24cm. XXVI,518 p. "
LEUCHTER (CH/ITDM),C.,88297,S,"88'297	C.Leuchter (CH/ITDM) Martin, James; Odell, James J.   Objektorientierte Mo- dellierung mit UML: Das Fundament.         -25cm.520 S. "
STÖCKLI (CH/STIZ),,88298,S,"88'298	Stöckli (CH/STIZ) Opaschowski, Horst W.   Generation  . Die Medienrevolu- tion entlässt ihre Kinder: Leben im Informationszeit- alter. Hamburg: British American Tobacco, 1999.    -27cm.221 S. "
THIEMANN (FI/H),A.,88299,S,"88*299	A. Thiemann (FI/H) Vollenweider, Markus F.   Die Sicherungsübereignung von Schuldbriefen als Sicherungsmittel der Bank, 2. Auflage, leicht korrigierter Nachdruck. Freiburg/Schweiz : Universitatsverlag, 1995.     -23cm. XXX,206 S. "
DR.REIMER (CH/IFUE),,88300,S,"88'300	Dr. Reimer (CH/IFUE) Borghoff, Uwe M.; Pareschi, Remo (Eds.).   Information technology for Knowledge Management. Berlin: Springer-Verlag, 1998.         -25cm.XI,232 S, "
DR.MENTELE (CH/PLPE),,88301,S,"88'301	Dr. Mentale (CH/PLPE) Ash, Russell.   Teh top ten of everything. London: Dorling Kindersley Limited, 1998.        -29cm, 256 p.,ill, "
MEIER (PF/GSSD),K.J.,88302,S,"88*302	Meier, K.-J. (PF/GSSD) Soldini, Alessandro; Pedroli, Andrea.  L'impsizione degli utili immobiliari; Commentario degli articoli da 123 a 140 LT ... con un appendice sulle norme di procedura e transitorie. Lugano: Giampiero Casagrande editore, 1996. "
BIBLIOTHEK,,88303,S,"88'303	Frau Bohnert fClI/VCT) Länder!, Rainer R.   Globales Marketing für Anlagefonds, Diss.Univ.Zürich. Zürich 1992.	-21cm.VI,205 S.,Anhang. "
FRAU KUBATZ (CH/PWEU),E.,88304,S,"88*304	Frau E. Kubatz (CH/PWEU) Pschyrembel, Willibald.   Klinisches Wörterbuch.	258.*A, Berlin: Walter de Gruyter, 1998.	-23cm, XXIII,1745	S.,ill, "
SUGAYA (CH/IA),,88305,S,"88*305	Sugaya (CH/IA) Larman, Craig.   Applying UML and patterns. An introduc- tion to object-oriented analysis and design. Upper Saddle River, NJ: Prentice Hall PTR, 1998.  -27cm, XIX,507 p, "
GARZOTTO (CH/IE),,88306,S,"88'306	Garzotto (CH/IE) Oestereich, Bernd.   Objektorientierte Softwareentwicklunc Analyse und Design mit der Unified Modeling Language. 4., aktualisierte Auflage. München: R. Oldenbourg Verlag, 1998.         -25cm.375 S. "
HÄRING (PF/GSSD),,88307,S,"88'307__________________________Häring (PF/GSSD)_______ Bauen, Marc.   Aufwertung von Grundstücken und Beteiligun- gen aus steuerrechtlicher Sicht ... Zürich: Schulthess Polygraphischer Verlag AG, 1998. -23cm.XLIV,286 S. "
CONRAD (PF/GSRS),H.P.,88308,S,"88*308	Conrad, Hp (P.F/GSRS) Izzo, Pierre.   Lebensversicherungsansprüche und -anwart- schaften bei der güterrechtlichen und erbrechtlichen Auseinandersetzung ... Freiburg/Schweiz: Universitatsverlag, 1999.       -23cm. LIV,406 S. "
CRAUSAZ (CH/IX),,88309,S,"88'309	Crausaz (CH/IX) Zahn, Hans E.  Wörterbuch für das Bank- und Börsenwesen. Band 1: Deutsch-Englisch. 4., überarbeitete und erwei- terte Auflage. Frankfurt/Main: Verlag Pritz Knapp GmbH, 1994.    -20cm. 536 S. "
INGLIN (TR/RW),,88310,S,"88'310	Inglin (TR/RW) IAS International Accounting Standards. Eine Einführung in die Rechnungslegung nach den Grundsätzen des IASC. Stuttgart: Schaffer-Poeschel, 1999.    -25cm.XVI,347 S. "
LEUCHTER (CH/ITDM),CL.,88311,S,"88*311___________________Cl. Leuchter (CH/ITDM) Fowler, Martin.   Analysemuster. Wiederverwendbare Ob- jektmodelle. Deutsche Uebersetzung von Andrea Dauer u.a. Bonn: Addison Wesley Longman Verlag GmbH, 1999.  -25cm. XXV,386 S. "
MEYER (CH/IA),CHR.,88312,S,"88*312      _	Chr. Meyer (CH/IA)_________ English, Larry p.   Improving Data Warehouse and business information quality. Methods for reducing costs and in- creasing profits. New York: John Wiley & Sons, Inc., 1999.	-24cm. XXVI,518 p. "
LEUCHTER (CH/ITDM),CL.,88313,S,"88-313	Cl. Leuchter (CH/ITDM) Entwurfsmuster. Elemente wiederverwendbarer objektorien- tierter Software. Deutsche Uebersetzung von .Dirk Riehle, (3,, unveränderter Nachdruck)„/ Erich Gamma, Richard Helm u.a. (Professionelle Softwareentwicklung}. Bonn: Add"
BARTHOLDI (CH/IE),,88314,S,"88'314	Bartholdi (CH/IE) Tritsch, Bernhard.   Microsoft Windows NT 4.0 Terminal Server einsetzen, ."", Unterschleissheim: Microsoft Press Deutschland, 1999. -24cm.XIX,315 S.,1 CD-ROM. "
BACH (CH/UK),,88315/1-5,S,"88'315/l-5	Bach (CH/UK) Pschyrembel, Willibald.   Klinisches Wörterbuch. 257.*A. Berlin: Walter de Gruyter, 1994.	-23cm. XXVII,1722 S..ill. "
GARZOTTO (CH/IE),,88316,S,"88'316__________________________Garzotto (CH/IE?______ Cockburn, Alistair.   Surviving object-oriented projects. A manager's guide. (4th printing). Reading, MA: Addison-Wesley Longman, Inc., 1999.  -24cm. XXI,250 p. "
DR.MENTELE (CH/PLPE),,88317,S,"88'317	Dr. Mentale (CH/PLPE) . Steiger, Rudolf.  Beziehungsstörungen im Berufsalltag. Ursache, Erscheinungsformen und Ueberwindungsmöglich- keiten. Frauenfeld: Huber & Co.AG, 1999.	-22cm.112 S, "
DR.MENTELE (CH/PLPE),,88318,S,"88'318	Dr. Mentele (CH/PLPE) Zukunftsmanagement, Trainings-Perspektiven für das 21. Jahrhundert, Hrsg. von Ute FlocJcenhaus. (GABAL Management Offenbach: GABAL Verlag GmbH, 1999.         -23cm.267 S. "
DR.MENTELE (CH/PLPE),,88319,S,"88'319	Dr. Mentele (CH/PLPE) Bleicher, Knut.   Das Konzept Integriertes Management. Visionen, Missionen, Programme. 5., revidierte und er- weiterte Auflage. (St.Galler Management-Konzept. Band 1) Frankfurt/Main: Campus Verlag GmbH, 1999.   -24cm.690 S. "
BACH (CH/UK),,88320,S,"88-320	Bach (CH/UK) Handbuch angewandte Psychologie für Führungskräfte. Führungskompetenz und Führungswissen. 2 Bande. Steiger. Berlin: Springer-Verlag, 1999.	-24cm.2 Bände. "
FRAU HOLLIGER (PF/GSRD),,88321,S,"88'321	Oibiiot Bank- und Finanzmarktrecht 2000, BF 2000. Regulierung und Selbstregulierung der Banken, Börsen, Efektenhändler, Anlagefonds und Finanzmärkte in der Schweiz. Hrsg.von Luc Thêevenoz, Urs Zulauf. Zürich: Schulthess Polygraphischer Verlag AG, 1"
MEIER (PF/GSSD),K.,88322,S,"88'322	-       K. Meier (PF/GSSD)_____ Risi, Andreas.   Mitarbeiteroptionen und -Aktien. Bewer- tung, Rechnungslegung, Besteuerung. (Diss.Univ.Zürich). Schriftenreihe der Treuhand-Kammer. Band 164. Zürich: Treuhand-Kammer, 1999.	-23cm.634 S. "
FRAU JENNY (CH/POO2),S.,88323,S,"88'323	Frau S.Jenny (CH/POO2) Pschyrembel, Willibald.  Klinisches Wörterbuch. 258. *A, Berlin: Walter de Gruyter, 1998.-23cm.XXIII,1745 S.,ill. "
KIETZ (CH/IFUE),,88324,S,"88'324	Kietz (CH/IFÜE) Kreines, David C.; Laskey, Brian.   Oracle database ad- ministration. The essential reference. Sebastopol, CA: O'Reilly & Associates, Inc., 1999. -24cm.XVII,560 p. "
KIETZ (CH/IFUE),,88325,S,"88'325____________________________Kietz (CH/IFUE)_____ Koch, George; Loney, Kevin.   Oracle 8: The complete reference. Berkeley, CA: Osborne McGraw-Hill, 1997.       -24cm. XXXVII,1300 p.,1 CD-ROM. "
D CONRAD (PF/GSRS),,88326,S,"88*326___________________D Conrad (PF/GSRS)_________ Bolanz, Max; Reinhart, Matthias.   Erben und Schenken. Steueroptimiert mit Weitblick und System. 2.*Auflage. Zürich: VZ Vermögenszentrum, 1999.        -21cm.145 S. "
LANG (PF/GSSD),P.,88327,S,"88'327	P. Lang (PF/GSSD) Bolanz, Max; Reinhart, Matthias.   Erben und Schenken. Steueroptimiert mit Weitblick und System. 2.*Auflage. Zürich: VZ Vermögenszentrum, 1999.         -21cm.145 S, "
SD DR.MENTELE (CH/PLPE),,88328,S,"88'328	______SD Pr.Mentele (CH/PLPE)____ Lasserre, Philippe; Schütte, Hellmut.   Strategies for Asia Pacific: Beyond the crisis.(Macmillan business). Basingstoke: Macmillan Press Ltd, 1999. -24cm.323 p.XVI. "
CAVIGELLI (CH/PESB),,88329,S,"88'329_________________    Cavigelli (CH/PESB)_______ Kobjoll, Klaus.   Motivaction. Begeisterung ist übertrag- bar. {9. Auflage). Zürich: Orell Füssli Verlag, 1999.    -23cm.140 S.,Portr. "
ENDRES (ID),,88330,S,"88'330	Endres (ID) Müller-Möhl, Ernst.   Optionen und Futures.Grundlagen und und Strategien für das Termingeschäft in der Schweiz und Oesterreich. 4. Auflage ... Zürich: NZZ Verlag, 1999.	-23cm.351 S. "
ENDRES (ID),,88331,S,"88'331	Endres (ID) Mühlemann, Daniel; Müller, Fritz.   Steuern.,und Kapital- anlage. STeuerhandbuch für den privaten Kapitalanleger. (2. Auflage). Zürich: Verlag Finanz und Wirtschaft AG, 1999.    -24cm. 332 S. "
LEUCHTER (CH/ITDM),,88332,S,"88'332	Leuchter (CH/ITDM) Dobson, Rick.   Programming Microsoft Access 2000. Redmond, WA: Microsoft Press, 1999.	-24cm, XIX,587 p.,1 CD-ROM, "
