Titel_Autor,Autorenvorname,RASignatur,Beginnt mit,Volltext
ENTWICKLUNGSTENDENZEN,,5637,A,"Entwicklungstendenzen       O o 3 > Entwicklungstendenzen, gesellschaftliche, in Osteuropa. Geleitwort von F.A.Lutz. Aufsätze von G.Bruderer ... [u.a.]. (Sozialwisaenachaftliche Studien für das Schwei- zerische Institut für Auslandforschung.Band 13.) Erle"
ENTWURF,,97493,A,"Entwurf Entwurf [des] Bundesgesetz[ea] Uter den Schutz von Per- sonendaten (DSG), [mit] Erläuternde[m] Bericht zum Ent- wurf eines Bundesgesetzes U/ber den Schutz von Personen- daten, 2 Bände.(Bd.I: 57 S.; Bd.11:111,235 S.). [Bern] Eidgenössisches Justiz-"
ENTWURF,,121,A,Entwurf Entwurf [eines] Bundesgesetz[esj über den. Allgemeinen Teil des Sozialversicherungarechts (ATSG). Bericht der Kommission des Ständerates: Parlamentarische Initiative Allgemeiner Teil Sozialversicherung. BBL. 1991 II S. 185-291. 
ENTWURF,,1487,A,"Entwurf Entwurf eines Gesetzes über den Versicherungsvertrag nebst den Entwürfen eines zugehörigen Sinführungegesetzes und einei Gesetzes, betreffend Abänderung der Vorschriften des Handels- gesetzbuchs über die Seeversicherung. Aufgestellt im Reiohs-Just"
ENTWURF,,7866/,A,"Entwurf / v // Entwurf eines Gesetzes über die Aufwertung von Hypotheken und anderen privatrechtlichen Ansprüchen <Aufwertungsgesetz: mit amtlicher Begründung, unter Gegenüberstellung mit dem gegenwärtigen Text der Dritten Steuernotverordnung und besonder"
ENTWURF,,7651,A,"Entwurf Entwurf eines Invalidenversicherungsgeeetzes mit dem Texte dee Gesetzes, betreffend die Invallditäts- und Altersversi- cherung, vom 22. Juni 1889. [Berlin] 0.0.[189-]	(170 S.) "
ENTWURF,,ORD.184,,"..t. Entwurf vom 9. Juli 1984 [zu einer] Verordnung Über die steuerrechtliche Behandlung der ""beruflichen Vorsorge ^BVV 4), mit Stellungnahme der Schweizerischen Vereinigung privater Lebensversicherer VPI». [deutsch + französisch] Bern,Zürich 1985-	-30cm."
ENTWURF,,ORD.182,A,Entwurf Entwurf vom 9. Juli 1984 [zu einer] Verordnung Über die steuerliche Abzugsberecatigung für Beiträge an anerkannte Voraorgef ormen ^BVV 5). [deutsch + französisch.] [Bern]   1984.	-30cm.Vervielf. 
ENTWURF,,ORD.183,,",.t.u,f Entwurf vom 18. Januar 1933 [zu einer] Verordnung über die steuerliche Atozugaberechtigung für Beiträge an aner- kannte Yorsorgef ormen \BYV 3/ . Erarbeitet von der Kommis- sion BW an der Sitzung vom 3. Juni 1983. [ßern]   1983.	-30cm.Vervielf "
ENTWURF,,ORD.190,A,"Entwurf Entwurf  zur Aenderung von Art.  4  des Versicherungsauf- siciitflgesetzes, Veraehinlassungsverfahren, Bern,   Eidgenossisch.es  Justiz- und Polizeidepartement, 1985.	^                             -30cm.2+11 Bl "
ENTWURFSMUSTER,,86996,,"P    ,	. Entwurfsmuster Entwurfsmuster. Elemente wiederverwendbarer objektorien tierter Software. (Autoren): Erich Gamma, Richard Helm u.a. Deutsche Uebersetzung von Dirk Riehle. (Amerikani- sche Originalausgabe ""Design patterns""). Bonn:   Addison-Wesley "
ENZYKLOPÄDIE,,,A,"Enzyklopädie (Enzyklopädie der Elementarmathematik. I) s. Weber,Heinrich. Arithmetik, Algebra und Analysis. 4. *'A.	1922 "
EPOCH,,2404,A,"Epoch Epoch,an, in life insurance; thirty-three years of admini stration of the Metropolitan life Insurance Company. A third of a century of achievement. 2.eu. Hew York 1924.	(38,306 p.) "
EPOCHE,,98725,A,"Epoche Epoche Atom und Automation. Enzyklopädie des technischen Jahrhunderts in zehn Bänden. Band VII: Kybernetik, Elek- tronik, Automation, Genf .-Verlag Kister  (1959).	(125 S.) 6111 "
EPPLE,BARBARA,,A,"Epple     ,     Barbara a.       Langensoheidt.       L's Handwörterbuch Fran- zösisch  (   1995   -	). "
EPSTEIN,EUGENE V.,5636,A,"Epstein, Eugene  V.	3 è 3 fe Epstein,Eugene V. Once upon an alp. [A houmorous esaay on Switzerland.] (III.by Hans Kuechler.) (Zurich, Freiburg i.Br.:) Atlantis(-Verlag,1968). -8°, 172 S., ill "
EPSTEIN,P.,,A,"Epstein,     P. s.  Pascal,E.   Repertorium der höheren Mathematik, "
EPSTEIN,PAUL,,A,"Epstein.Paul s. Weber,Heinrich.  Arithmetik,  Algebra und Analysis, 4.* A.	1922 "
EQUITABLE AGENCY ITEMS,,,A,Equitable Agency Items Equitable Agency Items. Pubi.by The Equitable Life Assurance Society of the United States. 1935 ff.-	[lückenhaft] Hew York 1935- 5*        4 
EQUITABLE,,,A,"Equitable Equitable Life Assurance Society, 1762-1962. s. Ogborn,Maurice Edward. Equitable Assurances "
EQUITY,,,A,Equity Equity linked life assurance  tables  (Stone & Coy.) 3.       Stone &  Cox.       Equity  linked life  assurance tables   ... 
EQUIVALENCE,,87026,A,"Equivalence Equivalence 95. Les actes, 6./7.10.1995, Lausanne. Traducteurs, terminologues, interprètes: les profession- nels du truchement linguistique dans le monde actuel = Uebersetzer, Terminologen, Dolmetscher: Sprachmittler heute = Traduttori, termin"
ERB,ANDREAS,,,"rb  ,  And re as Projekt-Management.  Der BWl-Leitfaden zu Teamführung und Methodik. 4. Auflage, vollständig überarbeitet und erweitert von Urs witsch, A'E1 ... "
ERB,FELIX,12175,A,"Erb   .Felix	-/jg Erb, Felix. Die Bankvollmacht. Ein praxisbezogener Leit- faden für den Juristen, Bankfachraann und Vermögensver- walter. With summary in Enlish. (Freiburger Dissertation.) ZUrich:Schulthess  Polygraphischer  Verlag,(1974).   -  23  cm XX"
ERB,HANS,,A,"Erb .Hans Erti,Hans. Der Rüden; Gesellschaftsbaus der Constaffel In Zürich. Ein Beitrag zur Kulturgeschichte des alten Zürich. Mit 11 Taf. & (Mitteilungen der Antiquarischen Gesellschaft in Zürich) <10?. Heujahreblatt), ZürichtGebr. Leemann & Co. 1959.   "
ERB,HEINZ,1270,A,"Erb  ,  Heinz Hr""b, Heinz.   Grundzuge dea Versicherungswesens. (6., un veränderte Auflage). Leitfäden für das Versicherungswe- sen;^ Zürich: Verlag des Schweizerischen Kaufmännischen Ver- bandes, (1990).	A             -22cm.182 S. 28913 i "
ERB,HEINZ,2379,,"Heinz Erb, Heinz. Notions élémentaires de l1assurance.Traduc- tion et adaptation françaises par Claude &amper.(2e édi- tion). Manuels d'assurance; nouvelle série, tome 3. Z uri oli, Editions de la Société suisse des	employés de commerce, (1984).         ^"
ERB,HEINZ,2385,A,"Erb  ,  Heinz Erb, Heinz.  Nozioni elementari di assicurazione. Tradu- zione: Geo Rossi. (2a edizione). Manuali d'assicurazione; pubblicati dall'Aasociazione svizzera per la formazione professionale nell'assicurazione. Zurigo, Edizioni della Società svizz"
ERB,MARTIN,324,,"B r ì>  ,  Martin Erb, Martin. Die Exportrisikogarantie des Bundes: Wesen, Funktion und Probleme. Wirtschaf tepolitiache Mitteilungen. 38. Jg., 1982, H. 9. Zürich, Gesellschaft zur Förderung der schweizerischen Wirtschaft, 1982.         A	-21cm.13 S. "
ERB,REMIGIUS,7866/,A,"Erb   ,  Remigius Erb.Reraigiua.    Die erlebnisiramaneote Natur des Rechts und der Sittlichkeit. Diss.Üiiiv,München. Basel:Schweighauser 1914.	(132 S.) 312	•                                                 4 "
ERBE,,97345/1-,A,"Erbe Erbe, europäisches. Nr.liStadt im Wandel. Nr.2: Die Auto- invasion. Nr.3: Probleme kunsthistorischer Städte. Die Herausgabe [dieser Schriftenreihe] ist ein Beitrag zur Europäischen Denkmalschutz-Kampagne des Europarates. Nr.4: Die Auswirkungen des Tu"
ERBE,K.,,A,"Erbe   ;  K Erbe,K	Wörterbuch der deutschen Rechtschreibung nebst einer eingehenden Darstellung der neuen Rechtschreibregeln une der lehre von den Satzzeichen. 2.*A.         42.-51.Taue. Stuttgart deutsche Verlagsgesellschaft  (1906).   (346 S.) (Rektor.L"
ERBRECHT,,10210,A,"Erbrecht	<f O % f O Erbrecht, das, im Fürstentum Liechtenstein. Auszug aus dem allgemeinen bürgerlichen Gesetzbuch ^ABGB) samt den Aenderungen durch §53 Schlussabteilung des liechtensteini- schen Personen- und Gesellschaftsrechtes (PGR) und den - noch gül"
ERBSCHAFTSTEUERGESETZ,,,A,ErbsGhaftsteuergesetz Erbschaftsteuergesetz:  Ausführungsbestimmungen vom 13.  Juli 1926 s.  Berolzheimer.Hane.  Ausfüiirungs'bes'tiniimingen.. . 
ERBSCHAFTS- UND SCHENKUNGSSTEUER,,,A,"Erbschafts- und Schenkungssteuer Daß zürcherische Gesetz über die Erbschafts- und Schenkungs- Steuer vom 26.April 1956. s.Schlegel,Eugen.   ...   1937. Zürich 0 "
ERDLE-HÄHNER,R.,,A,"Erdl-e-Hähner,R. s. Strohmeyer,F.; E'-H',£- ••• • Etudes françaises Ausgabe C. Grammatisches Beiheft. "
ERFAHRUNGEN,,91412,A,"Erfahrungen Erfahrungen mit der Gleitenden Arbeitszeit, Umfrage der Schweizerischen Arbeitgeber-Zeitung. Sonderdruck aus der ""Schweizerischen Arbeitgeber-Zeitung"", Nr. 44 bis 50, 1970 [Zürich] 1970.	~8°. 64 S. 11445 "
ERFAHRUNGSAUSTAUSCHGRUPPE,,7416,A,ErfaiirungsaustauBcìisruppe	r Erfahrungsaustausahgruppe für Kon;l\mktarbeobacfctiing. Protokolle 1950  ff. Zürich 1954 - 
ERFASSUNG,,2069/66,A,"Erfassung	^-° ^ ' J Erfassung, ""betriebstechnische, von veraicherungatechni- schen Daten zur Führung und Steuerung eines Lebensversi- cherungsbestandes. Schriftenreihe Betriebstechnische Fra- gen der Lebenaversicherung. 66.Folge. [Bonn], Verband der Leben"
ERFASSUNG,,83591,A,"E r f a s u n Erfassung des Energieverbrauchs.  Anleitung für den Be- auftragten. (Hrsger): Bundesamt für Konjunkturfragen. (Autoren; Charles Belaz, Alois Huser). Schriftenreihe RAVEL Industrie. (Bern: Eidgenössische	Drucksachen™ und Materialzentrale, Ver"
ERFASSUNG,,83590,A,"Erfassun Erfassung des Energieverbrauchs. Leitfaden für Industrie und Gewerbe. (Hrsger): Bundesamt fUr Konjunkturfragen. (Autoren: Charles Bélaz, Alois Huser), Schriftenreihe RAVEL Industrie. (Bern: Eidgenössische Drucksachen- und Materialzentrale, Vertri"
ERFOLG-BÜCHER,,,A,"Erfolg-Bücher Erfolg-Bücher,die. Bd.?O s. Brödner,Ernat. Unternehmensleitung. "
ERFOLGREICH,,83318,A,"Erfolgreich Erfolgreich verkaufen. Marketing in den Neunziger-Jahren, (Serie in ""Schweizer Handelszeitung""; [unter Mitwirkung] von Jan Krulis Randa) , (Zürich): Schweizer Handelszeitung, [l992],  -30cm.40 S. 30757	W- "
ERFOLGREICH,,86581,A,"Erfolgreich Erfolgreich werten. Das A und 0 der Marketingkommunika tion. (HandelsZeitung-Broschüre). (Zürich): HandelsZeitung [Buchversand, 1995J) -   -30cm A	70 S 33621                    W "
ERFOLGSFAKTOREN,,82426,A,"Erfolgsfafctoren Erfolgsfaktoren von Marktf Uhrerru   [Mit Beiträgen von] Klaas Apltz,  Wolfgang Gabler  [u.a.], (Landsberg am Lech):   Verlag Moderne Industrie,   (1988). ^^	-25cm.255 S 27403	^ "
ERGÄANZUNGSBERICHT,,2778/E,A,"Ergänzungsberi cht Ergänzungsbericht über die Eingliederung der bestehenden Vorsorgeeinrichtungen in die obligatorische berufliche Vorsorge nach Vorschlag Ständerat, (flachtrag zum Bericht vom Oktober 1978). Bern, Bundesamt für Sozialversicherung, 1981.  "
ERGÄANZUNGSHEFTE,,,A,"Ergänzungsnefte (Ergänzungshefte zum Deutschen Statistischen Zentralblatt, Heft 12) a. Gumbel.E.J. Das Zufallsgesetz des Sterbens.    1932 "
ERGÄNZUNGSLEISTUNGEN,,,A,Ergänzungsleistungen Ergänzungsleistungen zur AHV und IV ... AHV/IV-Statisti ken s.   AHV.   Ergänzungsleistungen zur AHV und IV ... AHV/IV-Statistiken ... 
ERGÄNZUNGSLEISTUNGEN ZUR AHV,,,A,Ergänzungsleistungen zur AHV e.   AHV 
ERGÄNZUNGSSTEUERGESETZ,,,A,"Ergänzungssteuergeee t z ErgänzungBBteuergesetz, vom 14. Juli 1893. Textausgabe mit Anmerkungen und Sachregister. 2.*A. s. Fernow.A         Ergänzungeeteuergeeetz...     1895 Berlin •        0 "
ERGÄNZUNGSTEUERGESETZ,,,A,"Ergänzungsteuergeeetz Fuisting.B      [u.] Strutz. Die preussiecfcen direkten Steuern, Bd II: Kommentar zum Ergänzungsteuergesetze. 2,A 1905. 884 "
ERGEBNISBERICHT,,2138,A,"Ergebnisbericht Ergebnisbericht [des] VeTband[es] der Lebeasversicherungs- Unternehmen. e.V.; Ausschuss für Betriebstechnik. Nr. [l] ff. - [Bonn], Verband der Lebensversicherunge-Unternehmen e.V.j Ausschuss für Betriebstechnik, 1982 -	-30cm. "
ERGEBNISSE,,,A,"Ergebnisse Ergebnisse der Mathematik und ihrer Grenzgebiete.   II/3 s.Kolmogoroff,A	Grundbegriffe der TSahrsoheinlicli- keitsrechnung.            1935. 2045 "
ERGEBNISSE,,3029,A,"Ergebnisse 3 Ergebnisse der Unfallstatistik der' fünf jährigen Be o bach - tungeperiode/ 1918^1922, 1923-1927, 1928-1932, 1933-1937, 1938-1942, 1943-1947, 1948-1952, 1953-1957, 1958-1962, 1963-1967,^. (Heraueg.v.d. ) Schweizerischen Unfallversicherungsazi"
ERGEBNISSE,,98012,A,"Ergebnisse Ergebnisse des gebundenen Zahlungsverkehrs - Resultats du service réglementé des paiements. [Heraueg.v.d.J Schweizerischen Verrechnungsstelle, Zürich. Jg.I, 1951 ff. - 33,1973.   [Erscheint nicht mehr.] Zürich 1951 - 1973. "
ERHALTUNG,,11043,A,"E r h a l t u n g	sj o Erhaltung, die, der Unternehmung im Erbgang. (Vorträge von Ernst Langenegger, Heinz Hausheer, Christloph von Greyerz, Max Kummer, Ernst Känzlg.) Berner Tage für die juristische Praxis, 1970. (Org.v.d.) Rechts- und Wirt- schaftswisse"
ERHALTUNG,,11065,A,"Erhaltung	-// & & £ Erhaltung und Entfaltung des Hechts in der Rechtsprechung des Schweizerischen Bundeagerichts . Festgabe der schwei- zerischen Rechtsfakultäten zur Hundertjahrfeier des Bundeagerichts, (1875-) 1975 = Stabilité et dynamisme du droit dans"
ERHARD,G.,,A,"Erhard , G ErhardtG    und E      Seiler. Die flohnungefürsorge der schweizerischen Industrie. (Zeitfragen der schweizerischen Wirtschaft und Politik. Nr.31). (Zürich) 1945.	(18 S.) "
ERHARD,GUSTAV,,A,"Erhard , Gustav Erhard.Gustav und Raymond Deonna. Die Stimmenthaltung als staatepolitische Gefahr. (Zeitfragen der schweizerischen Wirtschaft und Politik. Hr.25, 1945). (Zürich)1945.	(23 S.) 1945,5565	™   (Dr.) "
ERHEBUNG,GUSTAV,ORD/96,A,"Erhebung Erhebung Über die berufliche Alters-, Invaliden- und Hinterlassenenvorsorge. Pensionskassenstatistik 1970. Vom Eidgenössischen Statistischen Amt. [SA.aus Heft 9 ""Die Volkswirtschaft"" 1972.] Bern  1972.	-   30   cm.   2   S. "
ERHEBUNG,,188/11/IV/2,A,"Erhebung Erhebung über die Gütertransporte auf der Strasse - En- quête sur les transports routiers de marchandises 198A. Statistische Resultate.11:Verkehr^ Amtliche Statistik der Schweiz» Nr. 64. Forts.v: Erhebung über die Gütertransporte auf der Strasse,"
ERHEBUNG,,194,A,"Erhebung Erhebung über Schu^erleistungen im Kanton Zürich 1955. Beitrag zur Frage des TJebertnttsverfahrens aus der 6.Klasse in die Oberstufe der zurchenschen Volksschule. (Statistische Mitteilungen des Kantons Zürich. Dritte Folge, Heft 37). Zürich 1956."
ERHEBUNGEN,,7868/U,A,"Erhebungen """"L Erhebungen, statistische, und Schätzungen auf dem Gebiete der landwirtechaf t . - Statistiques et évaluations agricoles - Bearb . v , Schwe iz . Bauerneekre tariat , Bert '17-. Ausgabe 1940.     ^?tO Brugg:Schweiz.Bauernsekretariat 1940.   "
ERICHSON,BERND,,A,"Erichson  ,  Bernd s.   Analysenmethoden, multivariate. Eine anwendungsorientierte Einführung ... Von Klaus Backhaus, B1E' ... "
ERIKSSON,HANS-ERIK,87772,A,"Eriksson      ,      Hans     -     Erik Eriksson,   Hans-Erik;   Penker,   Magnus.       UML  toolkit. New  York:   John Wiley   &   Sons,   Inc.,    (1998).	-24cm. XVI,793   p.,1   CD-ROM: 37544 "
ERINNERUNG,,,A,"Erinnerung Erinnerung,eine,  an Albert I.,  König der Belgier s.   (Koenig.Hans).   Eine Erinnerung...	(1934) "
ERINNERUNGEN,,97268,A,Erinnerungen Erinnerungen einer Fünfzigjährigen. Flir ihre Freunde zum fünfzigjährigen Beatehen herausgegeben von der Coop Leuensveraicherunga-Genossenschaf t . Illustr. (Gestaltung Hana Peter Hort.) [Baael]l968.	(48 S.} G 901 
ERISMANN,THEODOR H.,,A,"Erìsmann  ,  Theodor  H. s,       Arasler, Robert; E'T'H. Jakob Amsler-Laffon, 1823-1912; Alfred Amsler, 1857-1940. Pioniere der Prüfung und Präzision. "
ERKENNTNIS,,,A,"Erkenntnis Erkenntnis, die, der Natur. Beiträge zur modernen Natur- philosophie. Mit einem Geleitwort von Hans Sachsse. 2., durchgesehene Auflage. (Vollmer, Gerhard. Was können wir wissen ? Band 2). Stuttgart: S.Hirzel Verlag, 1988.     -21cm,XXII,305 S. "
ERKLÄRUNG,,1224,A,"Erklärung Erklärung des Wiener-Kongresses die Schweizerischen Ange- legenheiten betreffend » Déclaration du Congres de Vienne. In: Sammlung der erneuerten Fundamental-Gesetze der Stadt und Republik Bern. S.22-78. Bern, Ludw.Albr.Haller, 1817.	-21cm. "
ERLÄUTERUNGEN,,ORD 128,A,"Erläuterungen Erläuterungen gin die Lebensversicherungsgeeelleehaf ten betreffend die Verordnung Uì>er àie Bewilligungspflicht für die Aufnahme von Geldern im Ausland [vom] 20. März 1974. [Zürich],   Schweizerische Nationalbank,   1974.       -30cm. ^	2 E"
ERLÄUTERUNGEN,,5136/29,A,E r l ä u t e r u n g e n Erläuterungen der eidgenössischen Steuerverwaltung zum Bundesratsbeschluse vom 13. Februar 1945 über die Siche- rung der Steueransprüche bei Versicherungen (stSiß) und zu der Verfügung des eidg. Finanz- und Zolldepartements vom 5
ERLASSE,,87708,A,"Erläuterungen Erläuterungen zur Versicherungsordnung samt dem Wortlaute der kaiserlichen Verordnung vom 22. November 1915. Heraueg.v.k.k.Juet i zministe rium. Wien 1915.	(59,211 S.) 597 "
ERLANGER,THEODOR,9139,A,"Erlanger .Theodor Erlanger,Th(eodor) und Lud(wig) Peuchtwanger. Kapitalflucht. Gesetze und Verordnungen gegen die Kapitalwanderung in das Ausland* nebst den einschlägigen Bestimmungen der Reicnaab- gabenordnung über Steuereid und Bankenkontrolle sowie des"
ERLASSE,THEODOR,1216,A,"Erlasse Erlasse betreffend die Strafreehtspflege für den Kanton Basel-Stadt. Herausg.v.Justizdepartement des Kantons Basel-Stadt. Basel:Schweighauser 1915-	(VI,247 S.) 879. "
ERLASSE,,70832/1-4,A,"Erlasse	?0 S 3 %/^ Erlasse,eidgenössische kriegswirtschaftliche. Systematisch und übersichtlich geordnet und zusammengestellt für Handel und Gewerbe. Sammelband l - III. /? *  __ i Zürioh:Extempore-Verlag 1941 — 1941,3305,****,	W               ' "
LAAGE,GERHARD,84029,,"a a g e G e r h 'a r t Laage,(Gerhart)• Herr,(Max-Walter). Die Wohnung heute für Ansprüche von morgen. Definition und Entwicklung eines deutschen Wohnungastandarda. Schriftenreihe zum Wohnungs- bau, Hr. 2. (ZUrich:)5chweizerische Zentralstelle für Baurati"
LABAND,PAUL,,,"a b a n d   ,   Paul Huber,Eugen und P,L. Zwei Gutachten über die Rechtafragen, die sich aus dem Rückkaufe der schweizerischen Hauptbahnen für deren Obligationenanleihen ergeben. 58B	^        (Prof .Dr.) "
LABAUVE,E,1501,A,"Labauve ,E laba;ive(E         Entscheidungen des Reichs-Qber-Handels- Gerichts im Versicherungswesen. Oldenburg i.G.:H.Hintzen 1880.	(X.707 S.Ì "
LABBÉ,ED,,A,"L a b b è   ,  E d d	L'apprentissage et la taxe d'apprantis- sage . 2e éd. Parisrl.Eyrolles 1928.	r }/     (164 S.) £	% ^^	(Direotexir) "
LABEL,,,A,"Label Label; das Zeichen recht entlöhnter Arbeit. (Was bezweckt das Label?). [in deutscher, französischer und italieni- scher Sprache]. Illustr. (Ölten O.J.).	(14 S.) 1945,5462               W "
LABHART,WALTER,,A,L a t» h a r  t     t     Walter a.       Schweizer Pioniere der Wirtschaft und Technik. Band 40:   Johann Jakoi> Sulaer-Hirzel   ...   Salomon Sulzer-Sulzer   ... Von Vi'L' . 
LABNO,TOMEK,97638,A,"L a t> n o  .  Tomek Labno, Tomek.  Die verhaltenswissenschaftlichen und ökonomischen Aspekte der FrUhpensionierung. Betriebs- wirtschaftliche Diplomarbeit Univ.Zürich. Baden 1994.	-30cm,87 El.»Anhang G Verfasser "
LABORDE,GENIE Z.,87956,A,"Laborde Genie z. Laborde, Genie Z.   Kompetenz und Integrität. Die Kom- munikationskunst des NLP, Aus dem Amerikanischen über- setzt von Isolde Kirchner. (4. Auflage. Reihe Pragma- tismus & Tradition. Band. 14). Paderborn: Junfermann Verlag, (1998). -24cm"
LABOUR DIRECTORY,,,A,"Labour Directory Labour Directory,international. 1925, Part II) s.Directory,international of employers' organisations. 1926, 1378 "
LACHAT,DAVID,87457,A,"Lâchât  ,  David Lâchât, David.   Le bail à loyer, (Lausanne}: ASLOCA Association suisse des locataires, (1997).	-24cm.621p. 36644 "
LACHAT,DAVID,83745,A,"Lâchât  ,  David Lâchât, David; Micheli, Jacques.   Le nouveau droit du ""bail. 2e édition, mise à jour. (Les guides de l'Associa- tion suisse des locataires - ASLOCA). Lausanne:	ASLOCA Association suisse des locataires, (1992).	A             -24cm.430 p 3"
LACHAT,DAVID,86158,A,"Lâchât  ,  David Lâchât, David} Micheli, Jacques.  Le nouveau droit du bail.(Les guides de l'Association suisse des locataires). Lausanne;	ASLOCA Association suisse	des locataires, (1990).	A	-25cm.430 p. 28311	W	9 Expl.    * "
LACHAT,DAVID,12640,A,"lâchât  ,  David Lâchât, David; Stoll, Daniel.  Das neue Mietrecht für die Praxis. (Zürich): Schweizerischer Mieterverband/Deutschschweiz, 1991.	-21cm.XXIII, A	412+54+16 S. 29037                    W "
LA CHAUX DE FONDS,,,A,LaChaux-de  -Fonds Plan de  La  Chaux-de-Fonds s.Plan...	o.J. O 
LACHEN,,,A,"Lachen Lachen is leven. Een bloemlezing in woord en ""beeld van Nederlandse humor van 1883 tot 1958. Bíjeengelezen door Mr.E.Elias en A.Duif in opdracht van de Levensverzekering Maatschappij ""Utrecht"" ter gelegenheid van haar vijfen- zventig-jarig testaan."
LACHENAL,GUSTEVE,81493,A,"Lachenal,     Gustave Lachenal,Gustave.  Les fraudes fiscales vues par un expert fiscal. Zurich:SKV 1948.	(72 S.) K 3J85	(Dr.) "
LACHENAL,PAUL,,A,"LacJienal , Faul Lacbenal.Paul. Problèmes de la politique intérieure et extérieure de la Suisse. (Tirage à part de l'Annuaire ""La Suisse""). Genève 1941.	(14 S.) "
LACHMANN,HANS,2483,A,"Lachmann   ,  H a n s Lachmann.Hans. Die Lebensversicherung in der Weltwirtschafts- krise. Wien:Verlag ""Die Versicherung""  1935.	(106 S.) , J 2261	W'MA,    (Dr.) "
LACROIX,GUY,,A,"Lacroix,     Guy s.  Ferbos,Jacques ;   L'G1.   Evaluation des  fonds de commerce "
LACROIX,S. F.,3445,A,"Lacroix,  S. F. Lacroix,S.F. Traité élémentaire de calcul différentiel et calcul intégral. 4e édition, revue, corrigée et augmentée Paris¡Bachelier 1828.	(XVI,685 p.) G 662 "
LADEGAST,K,3539,A,"Ladegast , K Ladegast,K      Finanzmathematik. Ein Leitfaden für die Praxis insbesondere für Kommunen, Banken und Sparkassen. Beriin:C.Keymann 1929.	(VI,12? S.) * S*	/ 1698	^PíDipl.-Versichemngsmathem.) "
LADNER,OTTO,5132/52,A,"Ladner, Otto	'        5 ¿ 3 2 /5% Ladner,0tto. Elektronische Datenverarbeitung und Mikro- film. SA.aus ""Versicherungswirtschaf-t?',1969,Hef t 24. (Schriftenreihe des Seminars für Veraicherungsbetriebsleh- re an der Universität München.Heft 52.) Karlsruhe "
LAEDERER,BENJAMIN,6683,A,"Laederer,  Benjamin Laederer,Benjamin. Zurich. Herausg.v.B'L'. Photographische Gestaltung von Hans Kasser. Texte von Max Huber, Emil Landoli...[u.a.].  Illustr. (Städte und Landschaften der Schweiz.[Band14]). Genf :Ed. Générales (I960).   '	(116 S.) 5775 "
LAEDRACH,WALTER,94824,A,"Laedrach, Walter Laedrach, Walter ; Juker .Werner . Bern, die Bundesatadt. Berner Heimatbücher . (Bd.)33. (5., von W'J1 vollst .überarb Auflage. ) BerniPaul Haupt,(1969).         - 25 cm. 56 5. ill. 7on Hrn. Fingerhuth erh. "
LAEMMEL,RUDOLF,3758,A,"Laemmel , Rudolf laemmel, Rudolf . Die Methoden 2ur Ermittlung von Wahrschein lichkeiten. ZüriCß:E.Speidel 1904.	(80 S.) 58B	""'   (Dr.)               J "
LAENGER LEBEN,,300,A,"Länger  l e ""b e n 3oo Länger leben. Ein Wegweiser zu einem gesunden Leben. Für ihre Versicherten herausgegeben von der PAK, Schweize- rische Lebensversicherungs-Geaellachaft. Jg. 1,1962- Basel 1962- "
LAERMBEKAEMPFUNG,,93187,A,"Lärmbekämpfun Lärmbekämpfung in der Schweiz, Bericht der Eidgenossischen Expertenkommission an den Bundeerat. [Herausg.v.] Eidge- nössischen Justiz- und Polizeidepartement. (Bern 19&3O	(557 S.) 7384 "
LAERMSCHUTZ,,,A,"Lärmschutz Lärmschutz an Nationalstrassen. Erläuterungen zur Praxis Sachbearbeitung:A.Lauber ...[u.a.], Schriftenfolge [der] Schweizerischen Vereinigung für Landesplanung, Nr. 15* Bern 1974. - 21 cm. 47 S. Abb. Tab. Beilage 2 Pläne: Testfall Freiburg und "
LAETT,A,,A,"L ä t t a. Tucker.Ben. Winston Churchill, "
LAEUBIN,P,1083/E,,"ä u D i n ,  P Laubin, P. Die steuerrechtliche Behandlung der Lebensver- sicherungen in der Schweiz. Bern:CosmoB-Verlag (I960).	(46 S.) 5650 "
LAEUBIN,P. H.,ORD 187,A,"L ä u b i n  .  P.  H se? Läubin, P.E.   Stifterunternehmen und Vorsorgestiftung - Vorsorgekapitalanlagen und Unternehmensfinanzierung.[vor- trag, gehalten am] Seminar ""Stiftung und Unternehmen.""der HSG-Weiterbildungsstufe der Hochschule St.Gallen für Wir"
LAEUBLI,H J,,A,"L ä u b 1 i , H J         Die Erträgnisse aus schweize- rischen Kapitalanlagen in Italian. (SA.a.d. Neuen Zürcher Zeitung, 1944, Hr.855 und 870). Zürich 1944-	(23 S.) 1944,4992.               ™                    * "
LAEUCHLI,KARL,81680,A,"Läuchli,Karl	8l'68û Laudili,C[arl].  Handbuch der Autogen-Schweissung.  Dübendorf '.Continental Licht- und Apparatebau A. G.   o.J. (503 S.) K 4301	(Dir.)                                          . "
LAFARGE,RENÉ,1408,A,"Lafarge.René Lafarge,René. Rapport fait au nom de la Commission d'assu rance et de prévoyance sociales, chargée d'examiner le projet de loi relatif au contrat d'assurance. Chambre des députés. 13e législature; session de 1926. Annexe au procès-verbal de l"
LAFAYE,B,,A,"L a f a y e , B Iafaye,B        Dictionnaire des synonymes de la langue française; avec une introduction sur la théorie des synonymes 10,éd. suivie d'un supplément. Paris¡Hachette (1857).       (83,1106,+IV,536,IV S.) 1968 "
LAFITTE,PROSPER DE,,A,"L a f i t t e , Prosper  de (Iafitte,ProBper de.) Solution élémentaire du problème de probabilités posé, en décembre 1895, à 1»examen de membre stagiaire de l'Institut dee Actuaires français. (ParisiSupont.impr. 1897).	(10 S.) I/ "
LAFFITTE,P. X.,,A,"Laffitte,   P.X. s.   Chapuís.Fredy.   Guide  pratique  du  chef "
LAFON,MARCEL,1425,A,"Lafon »Marcel	^ t¿ ¿ £ Lafon.Maroel. Des contrats d'assurance BUT la vie, sous- crits en monnaies étrangères ou en francs-or. Paris:Ltbr.du Recueil Sirey 1929,	(256 P-Ì 1672.                   W g K    (Dr.en droit') "
LAFONT,DAVID,,A,"Lafont, David (Lafont.Pavid).  L'assurance-vie r 2. éd. Paris [1936].	(56 p.) J "
LAG,,,A,Lag lag om försäkringsrörelse;gifven Stockholms slott den 24 ¿iili 1903. (Svens* Författnings-Samling. îïr.94) Stockholm 1903-	(76 S.) 
