Titel_Autor,Autorenvorname,RASignatur,Beginnt mit,Volltext
STAUFFER,HANS-ULRICH,87269,A,"Stauffer  ,  Hans-Ulrich     __ ______ Stauffer, Hans-Ulrich.   Pensionskasse: Das müssen Sie wissen. Tips für den richtigen Umgang mit der 2. Säule. (7., neu überarbeitete Auflage). Ausgabe 1997. K-Dossier. (Nr. 2). (Rorschach: K-Tip, 1997).	-24cm.95 S 3"
STAUFFER,HANS-ULRICH,87039,A,"Stauffer  ,  Hans  -  Ulrich Stauffer, Hans-Ulrich.   Die berufliche Vorsorge BVG / FZG/ZGB/OR. Rechtsprechung des Bundesgerichts zum Sozi- alversicherungsrecht. Hrsg. von Erwin Murer und H'-tJ'S'. Zürich: Schulthess Polygraphischer Verlag (AG, 1996), •-1"
STAUFFER,HANS-ULRICH,20020,A,"Stauffer      ,      Hans     -     Ulrich Stauffer,   Hans-Ulrich.     Pensionskasse:   Das   Beste  daraus machen   ! Zürich:   Unionsverlag,    (1995).	-21cm.229   S 33772 ,36603,   36758,                     ™ "
STAUFFER,HANS-ULRICH,82466,A,"Stauffer     ,     Hans-Ulrich Stauffer,   Hans-Ulrich.       Pensionskasse:   Das müssen  Sie wissen.   Tips  für  den richtigen Umgang mit  der  2.   Säule. (5.  Auflage).  K-Dossier,   (Nr,   2). (Rorschach: E.LÖpfe-Benz AG, 1993).	-24cra.87 S 32158 "
STAUFFER,HANS-ULRICH,12313,A,"Stauffer  ,  Hans - Ulrich Stauffer, Hans-Ulrich.  Die Arbeitslosenversicherung. Eine Darstellung des neuen Gesetzes anhand der anwendba- ren bisherigen Rechtsprechung, Zürich, Schulthess Polygraphischer	Verlag, (1984). Ä	-23cm.XXIII,321 S 22068	^ "
STAUFFER,H.-U.,,A,"Stauffer     ,     H,  -U. s.       Schuhmacher,  R.¡   S'H.-U.j   Thür,   H.       Meine Rechte am Arbeitsplatz   ... "
STAUFFER,PETER,84048,A,"Stauffer, Peter Stauf f er,Peter ;Emch,Urs. Das schweizerische Bankgeschäft, S.Auflage. [Mit einem Anhang aller das Bankwesen betref- fenden Gesetzesbestimmungen und Vollziehungsverordnungen und einem Stichwortverzeichnis.] Thun:0tt Verlag,(1972).	- 22 cm"
STAUFFER,PETER D.,,A,"Stauffer     ,     Peter     D. s.       Oeffentlicûkeitsar'beit fUr Dienstleistungen "
STAUFFER,WILHELM,31152,A,"Stauffer  .  Wilhelm Stauffer, Wilhelm.   Barwerttafeln. Von W1 S1, Theo Schaetzle [und] Marc Schaetzle. 4.»vollständig neube- arbeitete und erweiterte Auflage. Zürich: Schulthess Polygraphischer Verlag (AG), 1989. •-25cm.XXVI,686 S Kein SWK "
STAUFFER,WILHELM,12183A,A,"Stauffor  ,  Wilhelm Stauffer, w[ilhelm],   Nachtrag 1977 zur Praxis zum NAG. Textausgabe mit Hinweisen auf die wichtigsten Gerichts- und Verwaltungsentscheide sowie auf die vorbehaltenen Staat s ver träge. Zürich, Schulthess Polygraphischer Verlag,	(1977"
STAUFFER,W.,12183,A,Stauffer.W.	-4% / / 3 Stauffer.W. Praxis zum NAG. Teitausgabe rait Hinweisen auf die wichtigsten Gerichts- und Verwaltungaentseheide sowie auf die vorbehaltenen Staatsverträge. Bereinigter Nachdruck der 1. Auflage. ZUrich:Schulthess Polygraphischer Verlag
STAUFFER,W.,12150,A,"Stauffer,W. Stauffer.W. Praxis zum NAG. Textausgabe mit Hinweisen auf die wichtigsten Gerichts- und Verwaltungsentscheide sowie auf die vorbehaltenen Staatsverträge. Zurich:Schulthess Polygraphischer Verlag,1973.     - 23  cm 159  S. 13823 "
STAUFFER,WILHELM,3394,A,"Stauffer,Wilhe'lm	3 3 9 ç/ S tauf fer .Wilhelm; Schaetzle,Theo. Barwerttafeln. 5.^oli- stand ig überarbeitete und stark erwei terte Auflage. Zürich:Polygraphischer Verlag,(1970).       -8°, 42? S. 11220 "
STAUFFER,WILHELM,3586,A,"Stauffer .Wilhelm Stauffer.wfilhelm]; Schaetzle,Th[eo] . Barwerttafeln 2. »Aufl. Zürich:Polygr.Verlag (1958).	(59 S.) K 4713 "
STAUFFER,WILHELM,3572,A,"Stauffer,  Wilhelm und Th[eo]        Schaetzle.    Barwerttafeln für das Schadenersatzrecht. Zürich:poligraphischer Verlag  (1948).	(68 S.) K 975	V           (Dr.) "
STAUSS,BERND,87018,A,"Stauss  ,  Bernd Stauss, Bernd; Seidel, Wolfgang.   Beschwerdemanagement Fehler vermeiden, Leistung verbessern, Kunden binden. München: Carl Hanser Verlag, (1996).         -24cm.374 S 34999 "
STECKER,IDA,,A,"Stecker,   Ida e.Fisher,Irving.Die Kaufkraft des Geldes... 484 "
STEDER,KARL-HEINZ,,A,"Steder   ,   Karl-Heinz s.   Schubert,Rolf ;   S'K-H' .   Genossenschaf13-Handbuch. "
STEDING,CHRISTOPH,5026,A,"S  t e d i n g   ,   Christoph Steding, Christoph.    Das Reich und die Krankheit der euro päischen Kultur, Hamburg:Hanseatisehe Verlagsanstalt   U938Ì.       (48,772 S.) 2597 "
STEEL,DAVID,,A,"Steel     ,     David a.       Johnson,   orian.;   Andrew,   Martin;   S'ir. Quality management for IT  services   ... "
STEENKEN,EDUARD H.,,A,"Steenken,   Eduard     H. s.   (Comptoir  Suisse,   Laueanne.)   Goldenes  Buch, "
STEFAN,EMIL,,A,"Stefan .Emil Stefan,Emil. Ein Viertel-Jahrhundert Versicherungswesen in Oesterreich-Ungarn. Eine Darstellung der Entwicklung des Versicherungsgeschäftes sämtlicher Branchen von 1875-1900. Mit 30 farb.Diagr. Wien:Freytag & Berndt [19..].	(12 S.) 58B "
STEFANIC,KARL,91403/35,A,"Stefanie   ,   K  a r  l Stefanie ,Karl. Betriebswirtschaftliche Grundsätze der Unternehmungafiihrung. Worauf es bei der Chef arbeit ankommt. (SKV-Taschenbuch. Nr. 55. Ì ZUrich:Verlag  des  Schweiz.Kauf männischen Vereins"", (1973) . - 18  cm.   128  S. "
STEFANIC-ALLMAYER,KARL,91403/25,A,"Stefanic-Allmayer   ,   K  a r  1 *?-f¿0$ Stef anic-Allmayer „Karl . Schnell und richtig entscheiden. Die Technik der Entscheidungsgbildung. (SKV-Taschen- buch,Nr.25.) Zürich:Verlag des  Schweiz.Kaufmännischen Vereins,(1972). - 18  cm.   128  S. "
STEFFAN,FRANZ,5225,A,"S  t e f f a n  .    Franz (Steffan,Franz und Diehm.ïïalter.)    Die Bayerische Staatsbank, 1780-1955.   Geschichte und Geschäfte einer öffentlichen Bank. Zur 175. Wiederkehr des Griindungsjahres.(Illustr.Ï Herausgegeben vom Staatsbankdirektorium. München"
STEFFEN,C.,,A,"Steffen,C B.&rogg,H	,H f ür Kaufleute. Rennefafcrt u.G.St.Reotitakunde 1922. Privat   (Ür.Reber) (Dir.Basier Kantonalbank) "
STEFFEN,EMILIO,,A,"Steifen,   B   C   m i  l   i   o   ) s.   Sonnant,G(eorges)j   Schütz,H.;   S'È.   Svizzeri   in Italia,   1848-1972. "
STEFFEN,KLAUS-JOACHIM,4430,A,"Steffen, Klaus-Joachim Steffen,Klaus-Joachim. Liquidi tat und Liquiditätspolitik des Versicherungsunternehmens. Veröffentlichung des Instituts für Versicherungaviissenschaft der Universität Mannheim. Heft 2. Karlsruhe: Verlag VersicherungaWirtschaft,1970."
STEFFENSEN,J.F.,72217,A,"Steffensen.J Steffensen.J	F                      Interpolation-formulas with one more variables. (SA.  Skandinavisk Aktuarietidskrift,  1923). (Uppsala 1923).	(25 S.) A "
STEHLE,WILLI,,A,"Stehle      ,      Willi s.         Personalmarketing.   Hrsg.von Klaus   Moser,   WS'    ... "
STEHLI-HAUSHEER,RUDOLF,,A,"Stehli-Hausheer,     Rudolf s.   Schweizer Pioniere  der Wirtschaft uno  Technik.  Bd.2 "
STEHLI-ZWEIFEL,R.,5251,A,"S  t e h l i  -  Zweifel,   R. Stehli-Zweifel,R.     Stehli  & Co.,Zürich und New York 100 Jahre  Seideninduatrie,   1840-1940.   Illustr. ZürichrArt.Inst.Orell Füssli   (1940).	(111 S.) "
STEIGER,,,A,"Steiger Steiger      Lie Vorschriften über die eidgenössische Kriegssteuer. Mit einer Darstellung über Entstehung, Aufbau und finanzielle Tragweite der Steuer und einem alphabeti- schen Sachregister. Zürich:0rell FÜssli 1916.	(168 S.) 859.                "
STEIGER,EMMA,6690 H2,A,"Steiger,  Emma	é> ¿ *? Steiger (Emma.  Handbuch der sozialen Arbeit der Schweiz. Band I (Textband): Systematische Uebereicht über die soziale Arbeit. Band II (Nachgchlageband): Rechtliche Grundlagen, Behörden, Aemter und Werke der sozialen Arbeit. In Verb"
STEIGER,ERNST,,A,"Stelger   ,   E r  n  s   t a.   Peale,Norman Vincent.   Die  Kraft  positiven  Denkens "
STEIGER,FRITZ DE,84456,A,"Steiger,   Fritz     de	/V ^ $ Steiger,  F[ritz]   de.       Le  droit  des  sociétés  anonymes en Suisse.  Adaptation française  par J.Cosandey  et P. Subilla. Lausanne,  Payot,1973.	-23cm.  407  S. 15  360                                             A W"
STEIGER,FRITZ VON,1748,A,"Steiger,  Fritz  von Steiger,p[ritz] von. Das Recht der Aktiengesellschaft in der Schweiz. 3., neubearbeitete und ergänzte Auflage. Zürich: Polygraphischer Verlag AG, (1966).   (372 S.) 8601 "
STEIGER,FRITZ VON,1675,A,"Steiger,  Fritz von	^6 ? 3 Steiger,F[ritz] von. Grundriss des schweizerischen Genossen- schaf tsrechtes. 2.,neu überarbeitete und ergänzte Auflage von ""Die Eintragungen der Genossenschaft im Handeleregister."" Zürich:Polygr.Verlag 196?.	(190 S.) 7037      "
STEIGER,FRITZ DE,84454,A,"Steiger,   Fritz       de	ftl </ S' */• Steiger,F[ritz] de. Formulaire de statuts. Société ano- nyme , Société à responsabilité limitée, Société coopérati- ve, avec annotations, par F'S*. Adaption française par René Couchepin. 2e édition. Publié par la Fé"
STEIGER,F. VON,1805,A,"Steiger, F. von Steiger,F.von. Formulare über Gesellschaftsstatuten. Aktiengesellschaft, Gesellschaft mit beschränkter Haftung, Genossenschaft mit Anmerkungen. 2. , neubearbeitete Auflage. Herausgegeben vom Schweizerischen Notarenverband . Zürich¡Polygrap"
STEIGER,FRITZ VON,94463,A,"Steiger, Fritz von Steiger,F(ritz) von. Die Eintragungen der Genossenschaft im Handelsregister. Zürich:Polygraphischer Verlag A.G. (1939).     (107 S.) ^»         Handelsregister) 1939,2632.	-(Vorsteher d.eidg.Amtes f.d "
STEIGER,FRITZ VON,70828,A,"Steiger, Fritz      von	~¿ o ¿> ^ n Steiger,F[ritz] von. Die Anpassung der Aktiengesellschaften an das neue Recht . Zürich:Polygr.Verlag  (1937Ï-	(49 S.) *	À 2430                                                       ^	(Adjunkt) "
STEIGER,FRITZ VON,1257,A,"Steiger.Fritzvon	-f %/ 3 Steiger(F/VitzJ von. Prüfung und Eintragung der Aktienge sellschaft beim Handelsregister. Zürich:Polygraphischer Verlag A.G. (1937Ì.   (100 S.) ^_     f.d.Handelregisteri 2425.	^^ (Fürsprech,Adj.d.eidg.Amtes "
STEIGER,J.,91535,A,"Steiger     ,     J. Steiger» J. Zweite Säule: Sozialwerk oder Geschäft ? Vollausbau der AHV/IV als""Alternative zur Drei-Säulen- Konzeption.""(Rote Welle. 4). Zürich,   Limmat Verlag Genossenschaft,   (1977).       -21cm. A~	166  S.Tab 16021	™ "
STEIGER,J.,72239,A,"Steiger,  J Steiger,J	Richtlinien für die Durchführung des Art.34 guatar:   Schweizerische Alters- und Hinterlassenen- Vereicherung. (Erw.SA.a. Schweiz.ZentraTblattee  für Staats- und Gemeinde- verwaltung) . Bern:Francke  [l93.].	(38 S.) "
STEIGER,J.,70645,A,"Stelger, J Steiger, J         Die finanzpolitische Seite der obliga- torischen schweizeriaohen Alters- und Hinterbliebenen-Ver- sicherung. Bericht erstattet auf Anregung des Schweiz. Verbandes der Un- ter s tut zungakas sen und Stiftungen für Alter und In"
STEIGER,J.,1199,A,"Steiger,  J S teiger, J         Grundzüge des Ftnanzhaushaltes der Kantone und Gemeinden. [2 Teile in einem Band], Bern:A.Francke 1903.	(VIII,281+457 S.) 505.	(Dr.iur.) "
STEIGER,JACOB,,A,"Steiger, Jacob Steiger,Jacob.  Betrachtungen über den Finanzhaushalt der Kantone und ihre Beziehungen zum Bund. SA.a.d.6.Lieferung der ""Zeitschrift für echweiz.Statistik"", 1899. Bern¡Stampfli $ Co.  1899.	(106 S.) •	A 58B "
STEIGER,OTTO H.,,A,"Steiger,   Otto    H Steiger,Otto H	Hemmungen. Tiieorie und Praxis der Selbsthilfe. Zürich:Reta-Verlag	(6? S.Ì 1945,5337 "
STEIGER,PETER,,A,"Steiger,   Peter s.   PLENAR.   Planung - Energie -  Architektur "
STEIGER,VIKTOR JAKOB,5081,A,"Steiger,  Viktor      Jakob Steiger, V[iktor]  j[akob] und C[amille] Higy.     Bund,   Kantone, Gemeinden,   1913-33- (Finanzhaushalt der Schweiz-Steiger. I) . Bern:K.J.Wyes  Erben 1934.	(XVII,456 S.) 2110                                                  "
STEIGER,WERNER VON,11001,A,"Steiger,     Werner       von Steiger,  Viervier  Tori.     Handelsrecht.   2.   Halbband . (Schwei zerisches Privatrecht.   Bd,   VIII/2) . Basel:   Helling & Lichtenhahn Verlag AG,   (1982).     -24cm. A	XXI,480   S. 2o479 "
STEIGER,WERNER VON,1720,A,"S te ige'r , Tí e r n e r von Steiger,Werner von. Der Wohnsitz als Anknüpfungsbegriff im internationalen Privatrecht. Abhandlungen zum schweizerischen Recht. N.F. Heft 98. Bern:Stampfli 1934.	(V,186 S.) 2112                      ^P      (Hr. .Fürsprecher)"
STEIGER,W. VON,,A,"Steiger,W	von Steiger, W [erner] von. Die Staatsangehörigkeit der Handele- Gese 11 sohaften. Vortrag, gehalten in der Schweiz. Vereinigung für internatio- nales Recht am 28. Juni 1931. Druckschriften der] Sohweizerische[n] Vereinigung für inter- nationale"
STEIGMEIER,BEAT,,A,"Steigmeier      ,BeaL s.        Controller  und  Controlling   /   Albrecht Deyhle,   B'S'    ... "
STEIMANN,FLAVIO,,A,"Steimann,Flavlo	o s.       Heuberger,  Hermengild;   Imgruth, Peter;   S'F'. Man muss  den Schritt nach seinen Beinen machen  ... "
STEIMEL,R.,5630,A,"Steiroe-1   ,   R, (Steimel,R. unter Mitarbeit von C. Baumann.) J.D.Herstatt, Das alte und das neue Bankhaus. (2. Auf läge.) (Köln  1967.)	-4°,   115  S.,   ill "
STEIN,LUDWIG,5335,A,"Stein,  Ludwig	53 3 a* Stein,Ludwig.    Aus dem Leben eines Optimisten. Berlin :Brückenverlag 1930.	(512 S.) 1770.	W $                                               ^ "
STEIN,PETER,12607,A,"Stein  .  Peter Stein, Peter.   Das neue Unfallversicherungsgesetz. - Rusconi, Baptiste.   Le recours de l'assureur dans la loi fédérale sur l'assurance-accidents (LAA) . - Stein, Peter.   Der Regresa gemäss Unfallversicherungsgesetz. (Juristische Schrift"
STEIN,PETER,12580,A,"S t e i a  ,  P e t or Stein, Peter.   Die Genugtuung. Vortrag gehalten an der 4. Juristenkonferenz des TCS . 3. Auf läge, [stand]: Juni 1976. Juristische Schriften des Touring-Glut» der Schweiz Nr.l. Genf, Zentralsitz des Touring-Club der Schweiz, 1976. "
STEIN,PETER,12547,A,"Stein, Peter Stein,Peter. Unfall des Arbeitnehmers. Vortrag gehalten an der 9.Juriatenkonferenz des TCS vom 13.September 1973 ( Juristische Schriften des Touring-Club der Schweiz. Heft 4.) Genf:Zentralsitz des Touring-Club der Schweiz,1974. - 21 cm. 47 S."
STEIN,PETER,12089,A,"Stein, Peter	4 % O Stein,Peter. Das internationale Sozialversicherungsrecht der Schweiz. Mit Einschluss seiner Beziehungen zum Haftpflichtrecht. Bern:Stämpflit(1971).	- 23 cm. 130 S. 11980 "
STEIN,PETER,ORD.78,A,"Stein  , Peter Stein, Peter. Der Versicherungsvertrag, [insbesondere mit Bezug auf die Strassenbenützer]. Aus ""Touring 1969, Nrn. 4, 6, 8, 14 und 15"". [Genève 196g].	-30cm. Ausschnitte "
STEIN,PETER,2721,A,"Stein . Peter Stein, Peter; Rennhard, Josef.  Unfall, was nun ? Ein Handbuch für Versicherte.Ein Batgeber aus der Beobachter Praxis. (Glattbrugg, Der Schweizerische) Beobachter,Buchverlag; ([Zürich], Orell Füssli [Verlag], 1984).    -21cm.247 S G Hrsgeü 2"
STEINAUER,PAUL-HENRI,,A,"Steinauer     ,    Paul    -    Henri 3.      Deschenauz,  Henrlj   S'P'-H1.       Le nouveau droit matrimonial   ... "
STEINBACH,PETER A.,7866/M,A,"Steinbach.Peter A Steinbach, Peter A      Untersuchungen zum internationalen Fremdenrecht. Grundsätze internationaler Rechtsprechung über die Prinzipien des Fremdenrechts, insbesondere das Problem des völkerrechtlichen Schutzes von Individualrechten (Bonn"
STEINBACH-LEBBIN,,,A,"Steinbach     -    L  e  b  b  i  n Steinbach-Lebbin,   Claudia s.       Waser,   Peter  G.;   St'-L'jC1.       Praktische Pharmako- therapie  für Aerzte,Zahnärzte und Apotheker.   16.neu- bearbeitete Auflage   ... "
STEINBERGER,HELGA,84954,A,"Steinberger     ,     Helga (Steinberger, Helga).  Optische Informationsspeicher. Aktuelles, Organisatorisches, Marktübersichten. Fachbe- rater-(Serie). (Fellbach), Fachschriften-Verlag GmbH & Co K&, (1984). A	-21cm,420  S. 22174	™                        "
STEINDL,JOSEF,3634,A,"Steindl, Josef Steindl,Josef. Random processes and the growth of firms, A atudy of the Parete law. With 29 diagrams and 26 tab- les. London:Griffin,(l965).	(249 p.) 9033 "
STEINDORFF,ERNST,,A,Steindorff  .  Ernst a.  Europa-Recht. Verträge und Erklärungen zur Gründung der Europäischen Gemeinschaften ... Textausgabe mit ausführlichem Sachverzeichnis und einer Einführung von E1S' ... 
STEINEGGER,HUGO,82987,A,"Steinegger  t  Hugo Steinegger, Hugo.  Sport 85 von A-Z. Hrsg. vom Schweize- rischen Landesverband fUr Sport. (Derendingen), Habegger Verlag, (1985).      -20cm.440 S • 22436 "
STEINEMANN,EUGEN,94289,A,"Steinemann   ,  Eugen	94*289 Steinemann,  Eugen.    Die Volkswirtschaft in der Neue» Schweiz. Heraueg.v.d. Sozialdemokratischen Partei der Schweiz. Zürich:Genoseen6chaftebuchhandlung 1947.   (127 S.) K 700	W                      x\/ "
STEINEMANN,HANS,81663,A,"Steinemann,  Hans	$*/& è 3 SteiJiemann,Hans. Beitrage zur Darstellung der Sterbeflache und zur Extrapolation der Sterblichkeit unter besonderer Berücksichtigung der Sterblichkeit der männlichen schweize- rischen Bevölkerung.   Diss.Univ.Bern. Winterthur 1"
STEINER,E.,,A,"Steiner,     E. s.  Favre,Antoine,   Schuldbetreibungs- und Konkursrecht "
STEINER,ERNEST,,A,"Steiner,   Ernest 3.   Piccard,Robert;   Thilo.Emile ;   St'E.   Dictionnaire juridique  français   allemand   ...   . "
STEINER,FRANK,20003,A,"Steiner  . Prank Steiner, Frank.   Versicherungaleitfaden fUr den Klein- und Mittelbetrieb. (2.), von Ch. TrUb [und] G. Rüegge (Überarbeitete Auflage). Schriftenreihe Unternehmungs- führung im Gewerbe. 13. (Muri/Bern: Cosmos-Verlag AG, 1990).       -23cm."
STEINER,FRANK,2987,A,"Steiner  ,  Prank ¿If? . Steiner, Frank.   Versicherungsleitfaden für den Klein- und Mittelbetrieb. Schriftenreihe Unternehmungsfiihrung im Gewerbe, 15. (Muri b.Bern, Cosmoe-Verlag AG, 1982),     -23cm.151 S G Hrsgeber (2 Expl.).     ^ "
STEINER,FRIEDRICH,1580,A,"Steiner, Friedrich Steiner, Friedrich.  Die Währungsgesetzgebung der Sukzessions- Staaten Oesterreich-Ungarns. Eine Sammlung einschlagiger Gesetze, Verordnungen und be- hördlicher Verfügungen von 1892 bis 1920. Wien:Verb.österr.Banken u.Bankiers 1921.    "
STEINER,GEORGE A.,4086,A,"Steiner,   George     A.	^ O / fa Steiner,George  A.   Top  Management-Planung.   {Ins  Deutsche übertragen von Helga Höhlein.) (München: )Verlag Moderne Industrie, (Wolf gang Dummer ft Co., 1971.)	- 25 cm. 900 S. Abb. Tab. 12336 "
STEINER,GERHARD,87283/2,A,"St   einer      ,      Gerhard Steiner, Gerhard.   Windows NT 4 Server. Schnei1-Ueber sicht. (Haar/München): Markt	& Technik Buch- und Software- Verlag GmbH' (1997>-	-17cm.446 S.,Falttaf 36262 '36519,	^ "
STEINER,GERHARD,87283/1,A,"Steiner      ,      Gerhard & J   —— ®    /^ Steiner, Gerhard.   Windows NT 4 Workstation. Schnell- Uebersicht . (Haar/München):   Markt   &  Technik  Buch-   und  Software- Verlag   GmbH,    (1997).	-17cm.456   S.,Falttaf 36,262,   36394, 36519, "
STEINER,HANS,,A,"Steiner,   Hans s.   Tarifrevision,   die,   1971   in  der Motorfahrzeughaft- pflichtversicherung. "
STEINER,HANS-RUDOLF,12047,A,"Steiner, Hans-Rudolf        -;£ O < Steiner,Hans-Rudolf. Die Baulandumlegung dargestellt nach schweizerischem Recht unter besonderer Berück- sichtigung der Kantone Zürich, Bern und Basel-Stadt. ZUrcher Beiträge zur Rechtswissenschaft. Neue Folge, Heft 301"
STEINER,HEINZ,93278,A,"Steiner, Heinz Steiner,Heinz. Nachwuchsförderung für akademische Berufe Pädagogische, kulturpolitische und begatmngstheoretiache Aspekte der Begabtenf örderung. Bern:Haupt,(l971).	-22cm. 189 S. 11576 "
STEINER,HEIRI,,A,"Steiner,     Heiri s.     Landesausstellung,   Schweizerische,   Lausanne,   1964 Die   Schweiz... "
STEINER,JOSEF,86403,A,"Steiner  ,  Joaef Steiner, Josef.   Lotus 1-2-3 für Windows. Das Kompen- dium.Zur Einführung und zum Wachschlagen.L^itJ Diskette. Haar/München: Markt & Technik Verlag AG, 1991.    -24cm. A	789 S.,Diskette. 29883	^ "
STEINER,JOSEF,85825,A,"Stelner	Josef Steiner,   Josef.       Schnell-Uebersicnt dBASE III PLUS. (Haar b.München):   Markt & Technik Verlag AG,   (1988). -17cm.404 S t««*(/ "
STEINER,KARL,6734,,"/  *Z   7 l¿ Steiner,     Karl	^ /    3   * Steiner,  Karl.      Probleme  der Hochschulerweiterung    mit besonderer Berücksichtigung der Universität Zürich. (Jubilaumsgabe  zum 50jährigen Bestehen der Firma K'St', Generalunternehmung. ) Zürich,(Karl Sch"
STEINER,MARTIN,,A,"Steiner     ,     Martin a,       Maute,  Wolfgang;   S'M1,       Steuern und Versictierungen.  Ueberblick Über die steuerliche Behandlung von Versicherungen. "
STEINER,OTTO,,A,"Steiner,   Otto s. Moaer.Hana  [u.] O.St.  Kommentar zum neuen luzernischen Steuergesetz... "
STEINER,PETER,2913,A,"Steiner   f   P   e   t   e   r S t einer ,P e ter. Die Be tr i ebaun t erbrechungs-Ver Sicherung in der Schweiz. Veröffentlichungen des Instituts für Veraicherungswirtschaf t an der Hochschule St. Gallen für Wirtschafts- und Sozialwissenschaften. (Band)1"
STEINER,PETER,2110,A,"Steiner »Peter Steiner,Peter. Die Betriebsunterbrechungs-versicherung in der Praxis der privaten schweizerischen Sachversicherungs- Gesellschaften. Diplomarbeit an der Hochschule St.Gallen für Wirtschafts- und Sozialwisaenschaften. St.Gallen 1966.	(VIII,9"
STEINER,RICHARD,12559,A,"Steiner  .  Richard Steiner, Richard. Der Grundsatz von Treu und Glauben in der Rechtsprechung des Eidg.Versicherungsgerichts. Disa. Univ.Bern. Brig, Buchdruckerei Tscherrig AG, 1978.  -aicm.XVII,130 S G Prof.Maurer "
STEINER,RUDOLF,12506,A,"Steiner »Rudolf Steiner ,Rudolf. Haftpflichtdeckung zur Ergänzung von Sachversicherungen. Prüfung der Möglichkeit der Zusammen- fassung von Sach- und Haftpflichtversicherung im Hinblick auf die schweizerische Versicherungsgesetzgetmng. Diss . Universität "
STEINER-STOOSS,H.,,A,"Steiner- Stooss,  H Steiner-Stooss.H	Der Einfluss der Lungentuberkulose auf die Absterbeordnung der schweizerischen Bevölkerung, 1881-1888. (Mitt.Ver.achweiz.Versicherungsmathematiker,  Heft 1) Bern 1906.	(S.  103-126 "
STEINERT,R.,,A,"Steinert  ,  R. Steinert, R.; Hegewald, H.   Der Drechsler. (?.Auflage). Leipzig, VEB Fachb-uchverlag, (1979).    -23cm.l28 S.Abi), 18445	Kein SK "
STEINHARDT,ROLF,81227,A,"Steinhardt.Rolf	6l'227 Steinharàt.Rolf.  Reìchstoewertungsgesetz mit Durchführungs- bestimmungen,   Aenderungs- und Ergänzungsgesetzen. (Kohlharamer Kommentare). Stuttgart:Kohlhammer 1950.	(190 S.) G 280                                                 ^P "
STEINIGER,ARNOLD,,A,"Steiniger , Arnold Steiniger,Arnold und Carl Bennewitz. Bausparkasse und Lebens- versicherung. Berlin:C.Heymann 1931.	(4-0 S.) 'ff 2011	*   (Dr.iur.) "
STEINKAMP,,,A,"Steinkamp s«   Gesetzbuch,   bürgerliches "
STEINLIN,PETER,91411,A,"Steinlin, Peter	¿24 U.4J Steinlin,Peterv Geldentwertung und Versicherung. Vortrag ... . (SA.aus der Schweizerischen Arbeitgeber-Zeitung, Nr.48/49, 1965.) ZUrich:)Schweizeriacher Verband für privatwirtschaftliche Peraonalfüraorge,1965.	-8°, 18 S. "
STEINLIN,PETER,5126/17,A,"Steinlin,     Peter ____________________-___; Steinlin,p[eter]. Entwicklungstendenzen des Privatversiche- rungerechts. Vortrag gehalten an der Generalversammlung der Schweizerischen Gesellschaft für Vereicherungsrecht vom 25.November 196l. (SA.a.""Schweize"
STEINLIN,PETER,5126/18,A,"Stelnlin,     Peter Steinlin,p[eter].   Das Streben nach Sicherheit und die persönliche Freiheit. (S A. a. ""Schweizerische Versicherungs-Zeitsehrift"" ,   Jg. 29, Kr. 6.) Bern:Lang 1962.	(14 S.} "
STEINLIN-FRIZSCHE,PETER,2269/1.2,A,"Steinlin- Fritzsche ,  Peter Steinlin-Fntzache,Peter. Das Versicherungswesen der Schweiz. Eine Gesamtschau. 2 Bande. (Veröffentlichungen des Versicherungs-wirtschaftlichen Seminars an äer Handels-Hochschule St.Gallen. Band 9 u.10) Zurich-.Polygr.Verlag 19"
STEINLIN,PETER,5136/51,A,"Steinlin , Peter Steinlin, Pfeter]; Hangartner , J.M.  Unternehmung und Ver sicherung. (Betriebswirtschaftliche Mitteilungen. Heft 5). Bern:Haupt [1959].	<22 s-> J"" "
STEINMANN,ANDREAS E.,,A,"Steinmann,Andreas       E. a.   Jahre,   75,   Managernachwuchs   international,   lie .oec HSG. "
STEINMANN,ARTHUR,72263,A,"Steinmann   .Arthur Stöinmann,Arthur.     Zur wirtschaftlichen Ueberfremdung der Schweiz, 2.A. (SA.a.d.  Schweiz.Zeitschrift für Gemeinnützigkeit,1918). Zürich^eemann 1919-	(32 S.) "
STEINMANN,GOTTHARD,,A,"Steinmann     ,     Gotthard s.       Kommentar  zum Gesetz  Über  die  direkte Bundessteuer  von Peter Agner,   Beat  Jung, G'S'    ... "
STEINMANN,MARKUS,12635,A,"Steinmann     ,     Markus	/ ¿~~ íss^«>w Steinmann,  Markus.       Präventive Abwehrmassnahmen zur Verhinderung unfreundlicher Uetoernahmen mit Mitteln, des Aktienrechtes. Reihe Handels- und Wirtschaftsrecht. Band 21. (Grusen):  Verlag EUegger,   (1989).	"
STEINMANN,MATTHIAS,,A,"Steinmann  ,  Matthias a.   Frey, U(lrich); Kocher, G(erhard); S'M* . Das schweizerische Gesundheitswesen im Spiegel der Oeffentlichkeit ... "
STEINMANN,OTTO,,A,"Steinmann,     Otto s,   (Schmid,Hans-Rudolf).   Arbeitgeberpolitik   ...	1958, "
STEINMETZ,REMO,,A,"Steinmetz      ,      Remo s.        Volkszählung,   eidgenössische,    1990. Pendlermobilität   in   der  Schweiz. Autoren:    R'S'    ... "
STEINRISSER,JÜRG E.,1807,A,"Steinri-sser,     Jürg    E. Steinrisser, Jurg E.   Die Folgepflicht des  Rückversicherers Winterthur:P.G.Keller 1959-	(59  S.) 5572	(Dr.) "
STEINWENDER,KLAUS,2983/30,A,"Steinwender,     Klaus Steinwender,Klaus.   Das  Kindergeld.   (Sozialpolitik   in Deutachland   Nr.   30.) (Stuttgart:)   W.Kohlhammer,   (1963.)	(22   S.) "
STELLENWECHSEL,,,A,"Stel lenwechsel Stellenwechsel und Entlassung. Hrsg. von Thomas Geiser und Peter Münch s.   Geiser, Thomas ; Münch, Peter.   Stellen- wechsel und Entlassung ... "
STELLUNG,,,A,"Stellung Stellung des Grosshandels zur zukünftigen Steuergesetz- gebung: Reformvorschläge. [Herausg.v.d.] Delegation des Handels,.. (Basel 1942)	{29 S.) 1944,5076. "
STELLUNG,,2643,A,"Stellung Stellung, die, der bestehenden und neu entstehenden Versi- oherungaeinriciitimsen im Rahmen der Alters- und Hinter- lassenenversicherung. Bericht des Bundesamtes für Sozial- versicherung an die Eidgenössische Expertenkommission für die Einführung"
